{"scopus-eid": "2-s2.0-85209649591", "originalText": "serial JL 271189 291210 291789 31 90 International Journal of Pharmaceutics INTERNATIONALJOURNALPHARMACEUTICS 2024-11-15 2024-11-15 2024-11-21 2024-11-21 2024-12-11T16:53:23 1-s2.0-S0378517324011815 S0378-5173(24)01181-5 S0378517324011815 10.1016/j.ijpharm.2024.124947 S300 S300.1 FULL-TEXT 1-s2.0-S0378517324X00198 2024-12-11T17:01:14.877169Z 0 0 20250105 2025 2024-11-15T17:03:34.053921Z absattachment articleinfo articlenumber articletitlenorm authfirstinitialnorm authfirstsurnamenorm cid cids contenttype copyright crossmark dateloaded dateloadedtxt datesearch datesort dateupdated dco docsubtype doctype doi eid ewtransactionid fundingbodyid hubeid indexeddate issn issnnorm itemstage itemtransactionid itemweight oauserlicense openaccess openarchive pg pgfirst pii piinorm pubdatestart pubdatetxt pubyr sectiontitle sortorder sponsoredaccesstype srctitle srctitlenorm srctype ssids alllist content oa subj subheadings suppl tomb volfirst volissue volumelist webpdf webpdfpagecount yearnav figure table e-component body mmlmath acknowledge affil appendices articletitle auth authfirstini authfull authkeywords authlast highlightsabst otherkwds primabst ref specialabst 0378-5173 03785173 UNLIMITED JISC2022 true 668 668 C Volume 668 4 124947 124947 124947 20250105 5 January 2025 2025-01-05 2025 Research Papers article fla \u00a9 2024 The Author(s). Published by Elsevier B.V. RAPESEEDOLEOSOMESFACILITATEINTESTINALLYMPHATICDELIVERYORALBIOAVAILABILITYCANNABIDIOL JI L 1 Introduction 2 Materials and Methods 2.1 Materials 2.2 Preparation of oleosome-like protein-free artificial emulsion vehicle 2.3 Preparation of rapeseed oleosomes vehicle 2.4 Preparation of CBD-loaded artificial emulsion, oleosomes and rapeseed oil 2.5 Particle size measurement of emulsions 2.6 Zeta potential measurement of emulsions 2.7 Triglyceride level determination 2.8 In vitro lipolysis 2.9 Peroxide value test 2.10 In vivo pharmacokinetics and biodistribution 2.11 Bioanalytical conditions 2.12 Data analysis 3 Results 3.1 Physicochemical properties of CBD-loaded rapeseed oleosomes and artificial emulsion 3.2 In vitro lipolysis of CBD-loaded rapeseed oil, rapeseed oleosomes and artificial emulsion 3.3 Peroxide value of CBD-loaded rapeseed oil and released oils from CBD-loaded rapeseed oleosomes and artificial emulsion 3.4 Pharmacokinetics of CBD following oral administration in different formulations 3.5 Biodistribution of CBD following oral administration 4 Discussion 4.1 The physicochemical properties of CBD-loaded rapeseed oleosomes and artificial emulsion 4.2 CBD-loaded rapeseed oleosomes improves the intestinal lymphatic delivery and systemic bioavailability of CBD compared with CBD-loaded rapeseed oil and rapeseed artificial emulsion 5 Conclusion CRediT authorship contribution statement Acknowledgements Appendix A Supplementary data References ALICEBROOKES 2024 N ARZIMANOGLOU 2020 1 14 A BEISSON 2001 47 58 F BENITOGALLO 2015 353 362 P BENITOGALLO 2016 3526 3540 P BENZONANA 1965 121 136 G BHATTACHARJEE 2016 337 351 S CARRIERE 2016 297 305 F CHEN 2018 217 221 K CHO 2018 9301 9309 H CHU 2023 90 102 Y COUEDELO 2015 1726 1735 L COURT 2024 1 13 M DAHAN 2008 1 10 A DECHIRICO 2018 419 426 S DELEU 2010 125 132 M DING 2020 105418 J DING 2021 10875 10886 J FALLINGBORG 1999 183 196 J FAUL 2007 175 191 F FEENEY 2016 167 194 O FENG 2021 43 49 W FENG 2021 1349 W FENG 2022 121947 W FRANCO 2020 1493 1500 V GERSHKOVICH 2005 394 404 P GERSHKOVICH 2012 291 300 P HAUSS 2007 667 676 D HESS 2016 1617 1624 E HOFFENBERG 2019 E JIANG 2011 165 170 R JOLIVET 2017 87 98 P KALEPU 2013 361 372 S KASZUBA 2010 4439 4451 M MARQUEZRUIZ 2008 LPI. S904 G MARTINRUBIO 2019 4440 4451 A MCCLEMENTS 2018 22 41 D MCCONNELL 2008 63 70 E MECHOULAM 2002 11S S19 R MURESAN 2023 102664 P NICHOLS 2019 12 31 J NIEVAECHEVARRIA 2020 461 478 B NIKIFORIDIS 2019 102039 C PERUCCA 2020 795 800 E PORTER 2007 231 248 C PORTER 2013 2971 2975 C QIN 2021 1077 1089 C ROMEROGUZMAN 2020 109890 M SALVIATRUJILLO 2013 1472 1480 L SALVIATRUJILLO 2017 653 662 L SELTZER 2020 3203 E TZEN 1992 327 335 J WHITE 2009 5720 5726 D YAO 2022 130968 M YI 2014 19 27 J ZGAIR 2015 145 151 A ZGAIR 2016 3448 3459 A ZGAIR 2017 1 12 A JIX2025X124947 JIX2025X124947XL Full 2024-11-12T12:34:50Z FundingBody JISC UK 2022: Hybrid journals http://creativecommons.org/licenses/by/4.0/ 2025-11-21T00:00:00.000Z 2025-11-21T00:00:00.000Z http://creativecommons.org/licenses/by-nc-nd/4.0/ This is an open access article under the CC BY license. \u00a9 2024 The Author(s). Published by Elsevier B.V. 2024-11-24T04:34:44.546Z http://vtw.elsevier.com/data/voc/AddOnTypes/50.7/aggregated-refined Stoneygate Trust M902 Rosetrees http://data.elsevier.com/vocabulary/SciValFunders/501100000833 http://sws.geonames.org/2635167 This work was supported by Rosetrees Trust and Stoneygate Trust [grant number M902]. The authors would like to acknowledge the CBDepot.eu for their kind donation of synthetic CBD. The authors also would like to thank the Bio-Support Unit (BSU) team in the University of Nottingham for excellent technical assistance. item S0378-5173(24)01181-5 S0378517324011815 1-s2.0-S0378517324011815 10.1016/j.ijpharm.2024.124947 271189 2024-12-11T17:01:14.877169Z 2025-01-05 UNLIMITED JISC2022 1-s2.0-S0378517324011815-main.pdf https://s3-eu-west-1.amazonaws.com/prod-ucs-content-store-eu-west/content/pii:S0378517324011815/MAIN/application/pdf/d35026dd73baa5c8fef50910e74c9820/main.pdf main.pdf pdf true 676619 MAIN 11 1-s2.0-S0378517324011815-main_1.png https://s3-eu-west-1.amazonaws.com/prod-ucs-content-store-eu-west/content/pii:S0378517324011815/PREVIEW/image/png/ad692e97d9071da0099a26b4fde7df70/main_1.png main_1.png png 59433 849 656 IMAGE-WEB-PDF 1 1-s2.0-S0378517324011815-gr1.jpg https://s3-eu-west-1.amazonaws.com/prod-ucs-content-store-eu-west/content/pii:S0378517324011815/gr1/DOWNSAMPLED/image/jpeg/56d1348726f261c76bc26267dc688043/gr1.jpg gr1 gr1.jpg jpg 6990 167 311 IMAGE-DOWNSAMPLED 1-s2.0-S0378517324011815-gr2.jpg https://s3-eu-west-1.amazonaws.com/prod-ucs-content-store-eu-west/content/pii:S0378517324011815/gr2/DOWNSAMPLED/image/jpeg/91b9bf99b3c0e4fc9a039a645522e7f3/gr2.jpg gr2 gr2.jpg jpg 54544 938 382 IMAGE-DOWNSAMPLED 1-s2.0-S0378517324011815-ga1.jpg https://s3-eu-west-1.amazonaws.com/prod-ucs-content-store-eu-west/content/pii:S0378517324011815/ga1/DOWNSAMPLED/image/jpeg/9cf2a44b3127bf00b3786039de6169b3/ga1.jpg ga1 true ga1.jpg jpg 25553 200 500 IMAGE-DOWNSAMPLED 1-s2.0-S0378517324011815-gr3.jpg https://s3-eu-west-1.amazonaws.com/prod-ucs-content-store-eu-west/content/pii:S0378517324011815/gr3/DOWNSAMPLED/image/jpeg/01f3ed6dc361fc99c8683213a8bbb089/gr3.jpg gr3 gr3.jpg jpg 36061 370 533 IMAGE-DOWNSAMPLED 1-s2.0-S0378517324011815-gr4.jpg https://s3-eu-west-1.amazonaws.com/prod-ucs-content-store-eu-west/content/pii:S0378517324011815/gr4/DOWNSAMPLED/image/jpeg/26416b05d016a79911668e62b388f847/gr4.jpg gr4 gr4.jpg jpg 20521 484 258 IMAGE-DOWNSAMPLED 1-s2.0-S0378517324011815-gr5.jpg https://s3-eu-west-1.amazonaws.com/prod-ucs-content-store-eu-west/content/pii:S0378517324011815/gr5/DOWNSAMPLED/image/jpeg/593dd7771a3fc6b19812cfe58040a5c9/gr5.jpg gr5 gr5.jpg jpg 25250 266 533 IMAGE-DOWNSAMPLED 1-s2.0-S0378517324011815-gr6.jpg https://s3-eu-west-1.amazonaws.com/prod-ucs-content-store-eu-west/content/pii:S0378517324011815/gr6/DOWNSAMPLED/image/jpeg/377a95ef47774a3b16c35451e5f1e7f4/gr6.jpg gr6 gr6.jpg jpg 59913 886 533 IMAGE-DOWNSAMPLED 1-s2.0-S0378517324011815-gr1.sml https://s3-eu-west-1.amazonaws.com/prod-ucs-content-store-eu-west/content/pii:S0378517324011815/gr1/THUMBNAIL/image/gif/04294d2d9f52603c7e381c67b24ef192/gr1.sml gr1 gr1.sml sml 3759 117 219 IMAGE-THUMBNAIL 1-s2.0-S0378517324011815-gr2.sml https://s3-eu-west-1.amazonaws.com/prod-ucs-content-store-eu-west/content/pii:S0378517324011815/gr2/THUMBNAIL/image/gif/17775375388fe967b32c58721ea9931e/gr2.sml gr2 gr2.sml sml 3096 162 66 IMAGE-THUMBNAIL 1-s2.0-S0378517324011815-ga1.sml https://s3-eu-west-1.amazonaws.com/prod-ucs-content-store-eu-west/content/pii:S0378517324011815/ga1/THUMBNAIL/image/gif/b1f389ff40fc796965edb9fb63815576/ga1.sml ga1 true ga1.sml sml 8566 88 219 IMAGE-THUMBNAIL 1-s2.0-S0378517324011815-gr3.sml https://s3-eu-west-1.amazonaws.com/prod-ucs-content-store-eu-west/content/pii:S0378517324011815/gr3/THUMBNAIL/image/gif/f805c663c4da830baec28e20996f7619/gr3.sml gr3 gr3.sml sml 5619 152 219 IMAGE-THUMBNAIL 1-s2.0-S0378517324011815-gr4.sml https://s3-eu-west-1.amazonaws.com/prod-ucs-content-store-eu-west/content/pii:S0378517324011815/gr4/THUMBNAIL/image/gif/eff21cac8d1b33d50d0ecc5c71a426e3/gr4.sml gr4 gr4.sml sml 2603 163 87 IMAGE-THUMBNAIL 1-s2.0-S0378517324011815-gr5.sml https://s3-eu-west-1.amazonaws.com/prod-ucs-content-store-eu-west/content/pii:S0378517324011815/gr5/THUMBNAIL/image/gif/1585c575036b9ba54057313bdb69da61/gr5.sml gr5 gr5.sml sml 4564 109 219 IMAGE-THUMBNAIL 1-s2.0-S0378517324011815-gr6.sml https://s3-eu-west-1.amazonaws.com/prod-ucs-content-store-eu-west/content/pii:S0378517324012201/gr6/THUMBNAIL/image/gif/1b5516082a68cb2f07f5a50f74380b34/gr6.sml gr6 gr6.sml sml 3858 163 98 IMAGE-THUMBNAIL 1-s2.0-S0378517324011815-gr1_lrg.jpg https://s3-eu-west-1.amazonaws.com/prod-ucs-content-store-eu-west/content/pii:S0378517324011815/HIGHRES/image/jpeg/0792fcd65e2baa21d374923715711e43/gr1_lrg.jpg gr1 gr1_lrg.jpg jpg 32748 739 1378 IMAGE-HIGH-RES 1-s2.0-S0378517324011815-gr2_lrg.jpg https://s3-eu-west-1.amazonaws.com/prod-ucs-content-store-eu-west/content/pii:S0378517324011815/HIGHRES/image/jpeg/a2745aaa244a6199b8f702d91118cbb5/gr2_lrg.jpg gr2 gr2_lrg.jpg jpg 429283 4159 1693 IMAGE-HIGH-RES 1-s2.0-S0378517324011815-ga1_lrg.jpg https://s3-eu-west-1.amazonaws.com/prod-ucs-content-store-eu-west/content/pii:S0378517324011815/HIGHRES/image/jpeg/b9a4ccc9d2a611791ed00ac45eda495b/ga1_lrg.jpg ga1 true ga1_lrg.jpg jpg 196419 885 2213 IMAGE-HIGH-RES 1-s2.0-S0378517324011815-gr3_lrg.jpg https://s3-eu-west-1.amazonaws.com/prod-ucs-content-store-eu-west/content/pii:S0378517324011815/HIGHRES/image/jpeg/0596e0b713d6a5c1c1e976987d433059/gr3_lrg.jpg gr3 gr3_lrg.jpg jpg 270201 1639 2362 IMAGE-HIGH-RES 1-s2.0-S0378517324011815-gr4_lrg.jpg https://s3-eu-west-1.amazonaws.com/prod-ucs-content-store-eu-west/content/pii:S0378517324011815/HIGHRES/image/jpeg/2bfc8dc2086d85486fe020eeaf61205b/gr4_lrg.jpg gr4 gr4_lrg.jpg jpg 159383 2144 1142 IMAGE-HIGH-RES 1-s2.0-S0378517324011815-gr5_lrg.jpg https://s3-eu-west-1.amazonaws.com/prod-ucs-content-store-eu-west/content/pii:S0378517324011815/HIGHRES/image/jpeg/06b5693806b7ade9491658ec34cf34a5/gr5_lrg.jpg gr5 gr5_lrg.jpg jpg 187300 1179 2362 IMAGE-HIGH-RES 1-s2.0-S0378517324011815-gr6_lrg.jpg https://s3-eu-west-1.amazonaws.com/prod-ucs-content-store-eu-west/content/pii:S0378517324012122/HIGHRES/image/jpeg/3f4074c61a1533b57af8b5e6403e78e7/gr6_lrg.jpg gr6 gr6_lrg.jpg jpg 471658 3926 2362 IMAGE-HIGH-RES 1-s2.0-S0378517324011815-mmc1.docx https://s3-eu-west-1.amazonaws.com/prod-ucs-content-store-eu-west/content/pii:S0378517324011815/mmc1/MAIN/application/vnd.openxmlformats-officedocument.wordprocessingml.document/ef5b1e6b575a097fe0c32ee5dfff1411/mmc1.docx mmc1 mmc1.docx docx 480137 APPLICATION 1-s2.0-S0378517324011815-si1.svg https://s3-eu-west-1.amazonaws.com/prod-ucs-content-store-eu-west/content/pii:S0378517324011815/image/svg+xml/705804bac63211995031a71d0c570684/si1.svg si1 si1.svg svg 26654 ALTIMG IJP 124947 124947 S0378-5173(24)01181-5 10.1016/j.ijpharm.2024.124947 The Author(s) Fig. 1 2D structure of Cannabidiol (Created by ChemDraw, Revvity Signals Software, Waltham, Ma, US). Fig. 2 Particle volume distribution and zeta-potential of rapeseed oleosomes and artificial emulsion before and after CBD loading (n = 3). A, volume distribution of rapeseed oleosomes and artificial emulsion; B, volume distribution of CBD-loaded rapeseed oleosomes and artificial emulsion; C, Zeta-potential of rapeseed oleosomes and artificial emulsion; D, Zeta-potential of CBD-loaded rapeseed oleosomes and artificial emulsion. Unpaired t test was used for analysis of differences in zeta potential values between artificial emulsion and rapeseed oleosomes at the same pH with or without CBD. It was found that almost all zeta potential values of artificial emulsion have significant differences compared with rapeseed oleosomes, except CBD-loaded artificial emulsion and CBD-loaded rapeseed oleosomes at pH 8. P < 0.05 was considered statistically significantly different. Fig. 3 CBD partitioning into lipid, micellar aqueous, and sediment phases after in vitro lipolysis of CBD-loaded rapeseed oil, rapeseed oleosomes and artificial emulsion (mean \u00b1 SD, n = 3). One-way ANOVA, followed by Tukey\u2019s multiple comparisons test was applied to evaluate the statistical significance of differences between means of CBD distribution into three phases. *, p < 0.05, ****, p < 0.0001. Fig. 4 Peroxide value for different rapeseed-based formulations (Mean \u00b1 SD, n = 3). ****, P < 0.0001. One-way ANOVA, followed by Tukey\u2019s multiple comparisons test was applied to evaluate the statistical significance of differences between means. Fig. 5 Plasma CBD concentrations-time profile following oral administration of 3 mg/kg CBD in different formulations in Sprague Dawley rats (Mean \u00b1 SD, n = 5/6). Fig. 6 Biodistribution of CBD at plasma tmax and tmax \u22121h following oral administration of 3 mg/kg CBD in different formulations in Sprague Dawley rats (Mean \u00b1 SD, n = 4). MLN, mesenteric lymph nodes. A, biodistribution of CBD at plasma tmax; B, biodistribution of CBD at plasma tmax \u22121h. One-way ANOVA, followed by Tukey\u2019s multiple comparisons test was applied to evaluate the statistical significance of differences between means. *, p < 0.05, **, p < 0.01. Table 1 Properties of CBD-loaded rapeseed oleosomes and artificial emulsion (Mean \u00b1 SD, n = 3). TG level (mg/mL * ) Median particle size (\u03bcm) CBD concentration (mg/mL) Artificial emulsion 382.57 \u00b1 24.50 1.09 \u00b1 0.01 ns \u2212 Rapeseed oleosomes Adjusted to be identical to artificial emulsion 1.00 \u00b1 0.06 \u2212 CBD-loaded artificial emulsion 235.36 \u00b1 11.44 2.03 \u00b1 0.15 ns 1.04 \u00b1 0.03 ns CBD-loaded rapeseed oleosomes Adjusted to be identical to CBD-loaded artificial emulsion 1.94 \u00b1 0.04 1.03 \u00b1 0.07 * Triglyceride levels are expressed as mg/mL triolein equivalents. The unit conversion formula is as follows: 1.0 mmol/L triglycerides = 0.885 mg/mL triolein equivalent triglycerides. The measured triglycerides concentration of pure rapeseed oil was 1043 \u00b1 81 mg/mL. ns not significantly different from corresponding oleosomes groups. Statistical analysis was performed using unpaired t test between artificial emulsion and rapeseed oleosomes groups with or without CBD. P < 0.05 was considered to represent a significant difference. Table 2 Plasma pharmacokinetic (PK) parameters of CBD following oral administration of CBD in different formulations (Mean \u00b1 SD). Formulations t1/2 a (h) tmax b (h) Cmax c (ng/mL) AUC0-\u221e d (h \u00d7 ng/mL) F e (%) n CBD-loaded rapeseed oil 3.5 \u00b1 0.4 5 36 \u00b1 8 273 \u00b1 58 17.6 \u00b1 3.8 5 CBD-loaded artificial emulsion 3.6 \u00b1 0.8 2\u20133 50 \u00b1 13 258 \u00b1 53 16.7 \u00b1 3.4 6 CBD-loaded rapeseed oleosomes 4.0 \u00b1 0.7 2 79 \u00b1 11 413 \u00b1 25 *** 26.7 \u00b1 1.6 *** 6 a half-life; b time to maximum concentration in plasma; c the maximum concentration in plasma; d area under the curve (AUC) from 0 to infinity; e bioavailability calculated based on (Zgair et al., 2015). *** , statistically significantly different from rapeseed oil and artificial emulsion groups (P < 0.001, one-way ANOVA followed by Tukey's multiple comparisons test within 3 lipid-based formulations). Rapeseed oleosomes facilitate intestinal lymphatic delivery and oral bioavailability of cannabidiol Liuhang Ji Writing \u2013 original draft Methodology Investigation a Wanshan Feng Writing \u2013 review & editing Methodology Investigation a Haojie Chen Writing \u2013 review & editing Methodology Investigation a YenJu Chu Writing \u2013 review & editing Methodology Investigation a Abigail Wong Writing \u2013 review & editing Methodology Investigation a Yufei Zhu Writing \u2013 review & editing Methodology Investigation a Graziamarina Sinatra Writing \u2013 review & editing Methodology Investigation a Filippo Bramante Writing \u2013 review & editing Methodology Investigation b Fr\u00e9d\u00e9ric Carri\u00e8re Writing \u2013 review & editing Validation c Michael J. Stocks Writing \u2013 review & editing Supervision Methodology Investigation a Vincenzo di Bari Writing \u2013 review & editing b David A. Gray Writing \u2013 review & editing Supervision Methodology Investigation Data curation Conceptualization b Pavel Gershkovich Writing \u2013 review & editing Supervision Resources Project administration Methodology Investigation Funding acquisition Data curation Conceptualization a \u204e a School of Pharmacy, University of Nottingham, Nottingham, NG7 2RD, UK School of Pharmacy University of Nottingham Nottingham NG7 2RD UK School of Pharmacy, University of Nottingham, Nottingham, NG7 2RD, UK b School of Biosciences, Sutton Bonington Campus, University of Nottingham, Loughborough, Leicestershire LE12 5RD, UK School of Biosciences Sutton Bonington Campus University of Nottingham Loughborough Leicestershire LE12 5RD UK School of Biosciences, Sutton Bonington Campus, University of Nottingham, Loughborough, Leicestershire LE12 5RD, UK c CNRS, Aix Marseille Universit\u00e9, UMR7281Bio\u00e9nerg\u00e9tique et Ing\u00e9nierie des Prot\u00e9ines, 31 Chemin Joseph Aiguier, 13402, Marseille Cedex 20, France CNRS Aix Marseille Universit\u00e9 UMR7281Bio\u00e9nerg\u00e9tique et Ing\u00e9nierie des Prot\u00e9ines 31 Chemin Joseph Aiguier 13402 Marseille Cedex 20 France CNRS, Aix Marseille Universit\u00e9, UMR7281Bio\u00e9nerg\u00e9tique et Ing\u00e9nierie des Prot\u00e9ines, 31 Chemin Joseph Aiguier, 13402, Marseille Cedex 20, France \u204e Corresponding author. Graphical abstract Due to high lipophilicity and extensive first-pass metabolic loss, cannabidiol (CBD) has low oral bioavailability. Co-administration of CBD and long-chain lipids facilitates the intestinal lymphatic delivery, resulting in higher systemic bioavailability, as well as high levels of the drug within the intestinal lymphatic system. However, despite previous attempts with various lipid-based formulations, the oral bioavailability of CBD is still limited. In this work, we have developed a novel formulation of CBD based on natural rapeseed oleosomes. In vivo studies in rats demonstrated that oral administration of CBD-loaded rapeseed oleosomes leads to substantially higher oral bioavailability and intestinal lymphatic targeting of CBD in comparison with rapeseed oil or artificial emulsion made of rapeseed oil and lecithin. In vitro mechanistic assessments, including in vitro lipolysis and peroxide value determination suggest that the lower oxidative state of the oil in oleosomes in comparison to crude oil or artificial emulsion is likely to be the main factor responsible for the superior performance of the CBD-loaded rapeseed oleosomes in vivo. Although further investigation will be needed, the data suggest that natural seeds-derived oleosomes can be used as a promising lipid-based drug delivery platform promoting the bioavailability and lymphatic delivery of lipophilic drugs. Keywords Cannabidiol Intestinal lymphatic delivery Lipid-based formulation Rapeseed oleosomes Oral bioavailability Abbreviations AUC Area Under Curve BCS Biopharmaceutical Classification System BSU Bio-Support Unit CBD Cannabidiol DDT Dichlorodiphenyltrichloroethane HPLC High-Performance Liquid Chromatography MLN Mesenteric Lymph Nodes PC Phosphatidylcholine PDA Photodiode Array Ultraviolet SD Standard Deviation SDS Sodium Dodecyl sulphate TG Triglycerides CYP Cytochrome P450 Data availability Data will be made available on request. 1 Introduction Cannabidiol (CBD) is a highly lipophilic Biopharmaceutics Classification System (BCS) Class II phytocannabinoid originally isolated from the Cannabis sativa plant. According to previous reports, CBD has substantial immunomodulatory effects at high concentrations, suggesting its potential in treatment of autoimmune diseases (Hess et al., 2016; Hoffenberg et al., 2019; Nichols and Kaplan, 2019; Zgair et al., 2017). Efficient delivery of CBD to the intestinal lymphatic system can lead to sufficient exposure of the immune cells to the drug, potentially resulting in more efficient treatment of autoimmune diseases (Zgair et al., 2017). Moreover, enhanced systemic bioavailability of CBD could lead to benefits for patients affected by conditions such as epilepsy or cancer (Alice Brookes, 2024; Arzimanoglou et al., 2020; Chen et al., 2018; Seltzer et al., 2020). As reported previously, cannabidiol is metabolized by cytochrome P450 (CYP) enzymes (mainly by CYP3A4 and CYP2C19) and glucuronosyltransferases (minor contribution) in the liver (primarily) and intestinal wall (Court et al., 2024; Jiang et al., 2011; Perucca and Bialer, 2020). Due to the extensive first-pass metabolism and poor aqueous solubility, the oral bioavailability of CBD following oral administration is limited (Franco et al., 2020; Mechoulam et al., 2002; Perucca and Bialer, 2020). It is reported that the oral bioavailability of CBD in fasting state in humans is as low as 6 % (Franco et al., 2020; Perucca and Bialer, 2020). Co-administration of highly lipophilic drugs and long-chain triglycerides to facilitate the intestinal lymphatic drug delivery is an effective strategy to improve the oral bioavailability (Kalepu et al., 2013; Porter et al., 2007; Porter et al., 2013). Lipid-based formulations usually contain an oil phase mixed or not with various types of surfactants to ensure dispersion of the oil phase in the gastrointestinal tract contents (Porter et al., 2007). Both the initial components of lipid-based formulations and their lipolysis products are important for the intraluminal processing and absorption of the drug (Carri\u00e8re, 2016). When long-chain triglycerides enter the gastrointestinal tract, they will be enzymatically hydrolysed to release fatty acids and monoglycerides. These lipid digestion products, together with bile salts and phospholipids form mixed micelles, facilitate the diffusion to the intestinal wall and eventually absorption into intestinal epithelial cells. In the enterocytes, long-chain fatty acids and monoglycerides are re-esterified to triglycerides and packed into chylomicrons. These large lipoproteins are then transported into the intestinal lymphatic system and from there to the thoracic lymph duct and systemic blood circulation, avoiding liver and hepatic first-pass metabolism (Kalepu et al., 2013; Porter et al., 2007). Therefore, if a highly lipophilic drug with appropriate physicochemical properties for affinity to chylomicrons is administered together with long-chain triglycerides, higher systemic bioavailability and efficient targeting into intestinal lymphatic system could be achieved, especially if the hepatic first-pass metabolism was a primary limiting factor of the oral bioavailability. We have shown previously that sesame oil facilitates the delivery of CBD to the intestinal lymphatic system following oral administration in rats (Zgair et al., 2017). As a result, CBD concentrations in lymph fluid could reach \u223c 250 times higher levels than in plasma, and systemic exposure was about 3-fold higher compared with lipid-free formulations (Zgair et al., 2017). In a later study it was found that olive oil formulation led to a similar extent of oral bioavailability and lymphatic delivery of CBD as sesame oil, but with somewhat lower variability (Feng et al., 2022). Interestingly, even with efficient intestinal lymphatic delivery of CBD associated with sesame or olive oil formulations, the oral bioavailability of the drug was only about 20 % (Feng et al., 2022; Zgair et al., 2016). In our previous attempts to improve further the bioavailability and lymphatic targeting of CBD, we have used pre-digested lipid formulations, medium-chain triglycerides or surfactants, resulting in higher micellar solubilisation of the drug in vitro, but natural vegetable oils still performed better than these formulations in vivo (Feng et al., 2021a; Feng et al., 2021b). This could potentially be due to existence of several minor constituents in natural oils, affecting their stability and digestion efficiency (Feng et al., 2021a). Therefore, in this work we have chosen to amend the approach of development of lipid-based formulations of CBD, and instead of pre-digesting, or increasing the emulsification or micellar solubilisation by various excipients, we have opted to use natural plant seeds-derived oleosomes as a drug delivery vehicle (Romero-Guzm\u00e1n et al., 2020). Oleosomes are triglyceride (TG) storage organelles in plant seeds and consist of a triglyceride core surrounded by a monolayer of phospholipids and proteins (De Chirico et al., 2018; Romero-Guzm\u00e1n et al., 2020). Although some in vitro studies assessed the potential use of oleosomes as drug delivery vehicles (Cho et al., 2018), it is unknown if they can indeed improve oral bioavailability and lymphatic delivery of CBD or other drugs. Thus, the aim of this work is to test the hypothesis that natural rapeseed oleosomes could increase the oral bioavailability and intestinal lymphatic delivery of CBD in comparison to artificial oleosome-like protein-free rapeseed-based emulsion or pure rapeseed oil. 2 Materials and Methods 2.1 Materials Rapeseed oil, sodium hydroxide solution (NaOH, 1 M), potassium bromide (KBr), L-\u03b1-phosphatidylcholine (\u223c60 %, from egg yolk), Trizma\u00ae maleate, sodium taurocholate hydrate, pancreatin from porcine pancreas (8 \u00d7 USP), 4,4-dichlorodiphenyltrichloroethane (DDT), acetic acid, isooctane, potassium iodide (KI, powder), sodium dodecyl sulphate (SDS), sodium thiosulphate and soluble starch were all purchased from Sigma-Aldrich (Dorset, UK). Synthetic CBD (Fig. 1 ) was kindly donated by CBDepot.eu (Teplice, Czech Republic). Pooled male Sprague Dawley rat plasma was purchased from Sera Laboratories International Ltd (West Sussex, UK). Rapeseed phosphatidylcholine (PC, > 98 %) was purchased from Stratech Scientific (Ely, UK). EnzyChromTM Triglyceride Assay Kit was purchased from Generon Ltd (Slough, UK). All other solvents were of high-performance liquid chromatography (HPLC) grade or higher. 2.2 Preparation of oleosome-like protein-free artificial emulsion vehicle The oleosome-like protein-free artificial emulsion preparation procedure was modified from previously reported methodology (Deleu et al., 2010). Rapeseed lecithin (40 mg) and rapeseed oil (760 mg) were first added into tubes, followed by addition of 1.2 mL water. The mixture was then homogenised using Bandelin Sonopuls HD 2070 ultrasonic homogenizer (Berlin, Germany) at 20 kHz, 15 s (full power, 60 % cycle, repeated 6 times with 25 s intervals). The emulsion was then cooled on ice for 1 min and filtered using syringe filter (pore size 5 \u03bcm). Triglyceride concentrations of the obtained artificial emulsion was measured by EnzyChromTM triglyceride assay kit using the manufacturer's instructions (BioAssay Systems, Hayward, CA, US). 2.3 Preparation of rapeseed oleosomes vehicle The procedure of extraction of rapeseed oleosomes from rapeseed seeds was based on a previous report (De Chirico et al., 2018). Briefly, rapeseed seeds were soaked in 0.1 M sodium bicarbonate buffer (pH 9.5) at 4\u00b0C for 16 h with a ratio of 1:4 (seeds: buffer, w / w). The liquid was then filtered off and seeds were crushed by a Kenwood BLX52 blender (Havant, UK) at full power for 90 s with the same buffer at a ratio of 1:7 (seeds: buffer, w / w). The mixture was filtered and centrifuged at 10,000 g for 30 min at 4\u00b0C using Beckman J2-21 centrifuge, JA-10 rotor (Brea, CA, US). The cream on the upper layer was collected and resuspended by gentle stirring in the sodium bicarbonate buffer 0.1 M (1: 4, cream: buffer, w: w). Subsequently, the emulsion was centrifuged again (10000 g for 30 min at 4\u00b0C). The cream was collected and resuspended in water by gentle stirring (1: 4, cream: water, w: w). The third centrifugation (10000 g for 30 min at 4\u00b0C) was then performed and the cream collected was the final rapeseed oleosomes batch. The triglyceride (TG) concentrations were measured by EnzyChromTM triglyceride assay kit using the manufacturer's instructions (BioAssay Systems, Hayward, CA, US). The oleosomes were diluted to TG levels of 380 mg/mL with water to resemble TG levels in the artificial emulsion. 2.4 Preparation of CBD-loaded artificial emulsion, oleosomes and rapeseed oil To prepare artificial emulsion loaded with CBD, the drug was pre-dissolved in rapeseed oil at a concentration of 4 mg/mL, and the emulsion was prepared as described above in Section 2.2. For loading CBD into rapeseed oleosomes, 981 \u03bcL of rapeseed oleosome emulsion (380 mg/mL TG concentration) were mixed with 19 \u03bcL solution of 100 mg/mL CBD in ethanol. The mixture was then stirred using a magnetic stirrer (400 RPM) at 37\u00b0C for 1 h. Density gradient centrifugation (1070 g, 22.5 h) was then applied by Eppendorf\u00ae 5810R Centrifuge with A-4\u201362 rotor (Hamburg, Germany) to separate the oleosomes or artificial emulsion from free CBD (Gershkovich and Hoffman, 2005; Muresan et al., 2023; Qin et al., 2021; Zgair et al., 2016). Subsequently, the upper layer containing the cream was collected and diluted in water to reach a TG concentration of 235 mg/mL. This resulted in CBD concentration of about 1 mg/mL in drug-loaded oleosomes and artificial emulsion. CBD-loaded rapeseed oil formulation was prepared by solubilising CBD in rapeseed oil at a concentration of 4.44 mg/mL. 2.5 Particle size measurement of emulsions The particle sizes of artificial emulsion and rapeseed oleosomes were measured by HORIBA LA960 laser diffraction particle size distribution analyser (Kyoto, Japan). Emulsion and oleosomes were diluted 5000-fold in water before measurement. All measurements settings were based on previous report (De Chirico et al., 2018). Median particle size and volume distribution were recorded. 2.6 Zeta potential measurement of emulsions A series of 10000-times water-diluted artificial emulsions and rapeseed oleosomes were prepared in 1 mL Eppendorf tubes. The pH values were adjusted to be between 3 and 10 using 0.1 M NaOH and 0.1 M HCl. Samples were then analysed using Malvern Zetasizer Nano ZS (Malvern, UK). The measurement settings were set based on a previous report (De Chirico et al., 2018). 2.7 Triglyceride level determination Triglycerides levels in artificial emulsion, rapeseed oleosomes and rapeseed oil were tested by colorimetric EnzyChromTM triglyceride assay kit using the manufacturer's instructions (BioAssay Systems, Hayward, CA, US). 2.8 In vitro lipolysis The digestion of CBD-loaded rapeseed oil, rapeseed oleosomes and artificial emulsion was assessed using an in vitro lipolysis model, which mimics lipid digestion processes in the small intestine (Benito-Gallo et al., 2015; Benito-Gallo et al., 2016; Feng et al., 2022; Feng et al., 2021a; Feng et al., 2021b; Gershkovich et al., 2012). The complete digestion buffer (pH 6.8) simulating fasted state consisted of 50 mM Trizma\u00ae maleate, 150 mM NaCl, 5 mM CaCl2, 5 mM sodium taurocholate hydrate and 1.25 mM L-\u03b1-lecithin. The incomplete digestion buffer (pH 6.8) that was used for lipase preparation consisted of 50 mM Trizma\u00ae maleate, 150 mM NaCl and 5 mM CaCl2. After all components in buffers were solubilised, the pH values of buffers were adjusted to 6.8 at 37\u00b0C. To obtain lipase preparation from porcine pancreatin, 1 g of pancreatin was added into 5 mL incomplete digestion buffer and vortexed for 15 min at room temperature. The supernatant containing the lipase extract was collected after centrifugation at 5 \u00b0C, 1794 g for 15 min, and stored on ice. The CBD-loaded artificial emulsion and rapeseed oleosomes (0.9 mL, 1 mg/mL CBD concentration), or CBD-loaded rapeseed oil (202.5 \u03bcL, 4.44 mg/mL CBD concentration, followed by addition of 697.5 \u03bcL water), were premixed with complete digestion buffer (35.5 mL) at 37 \u00b0C for 15 min. Then, 3.5 mL of the lipase preparation was added to initiate the lipolysis process and the pH value was maintained at 6.8 by means of Mettler Toledo T50 pH-stat titrator (Greifensee, Switzerland) using 1 M NaOH solution. The termination of reaction was set to the rate of addition of 1 M NaOH dropping below the threshold of 3 \u00b5L/min. The lipolysis medium was then separated into three fractions (sediment, micellar and lipid layer) by ultracentrifugation (SORVALL Discovery 100SE ultracentrifuge (Waltham, MA, US), TH-641 rotor, 269,071 g, 37 \u00b0C, 90 min). All fractions were separately collected and stored at \u221280 \u00b0C until analysis for CBD content. 2.9 Peroxide value test Oil contained in CBD-loaded rapeseed oleosomes and the artificial emulsion was released by freezing and thawing (di Bari et al., submitted manuscript). Briefly, the formulations were frozen in \u221220 \u00b0C for 24 h and then stored at ambient temperature for one hour to allow for complete thawing. The samples were centrifuged at 10,000 g for 15 min at ambient temperature using Biosan Microspin 12 centrifuge (Riga, Latvia) and released oil in the upper layer was collected. Subsequently, the peroxide values of these released oils and the CBD-loaded rapeseed oil were determined by sodium thiosulfate titration method (The American Oil Chemists' Society, 2011). Oils were weighed (\u223c1 g) and dissolved in 30 mL of the 3:2 acetic acid-isooctane mixture. Saturated KI solution (0.5 mL) was added, and the medium was stirred for 1 min. Then, 30 mL of distilled water, 0.5 mL of 10 % sodium dodecyl sulphate and 0.5 mL of starch indicator solution were added. The medium was titrated with 0.01 M sodium thiosulphate until the disappearance of the blue colour. Peroxide value (milliequivalents peroxide/ 1000 g of oil) was calculated using Equation (1): (1) Peroxide value = [ ( V oil - V blank ) \u2217 M ] / m where Voil is the titration volume of oil in mL, Vblank is the titration volume of blank in mL, M is the molarity of sodium thiosulphate solution in mmol/mL and m is the mass of oil in kg. 2.10 In vivo pharmacokinetics and biodistribution All experimental protocols were authorised by the United Kingdom Home Office and University of Ethical Review Committee in accordance with the Animals [Scientific procedures] Act 1986. In vivo pharmacokinetics and biodistribution studies were carried out using male Sprague Dawley rats, 276 to 300 g body weight (Charles River UK, Margate, UK). The animals were kept in the University of Nottingham Bio-Support Unit (BSU) under regulated temperature and humidity, 12 h light\u2013dark cycle. In the pharmacokinetic study, the right jugular vein was cannulated under general anaesthesia and rats were allowed two nights of recovery. Animals were fasted overnight for up to 16 h before pharmacokinetic study with free access to water. Three lipid-based formulations of CBD: CBD-loaded rapeseed oil, artificial emulsion and rapeseed oleosomes were administered by oral gavage to animals. Water was administered by a second oral gavage in CBD-loaded rapeseed oil group to provide the same volume of water that is contained in CBD-loaded artificial emulsion and rapeseed oleosomes. The dose of CBD was 3 mg/kg in all groups. CBD-loaded rapeseed oleosomes and artificial emulsion contained 1 mg/mL CBD. CBD-loaded rapeseed oil contained 4.44 mg/mL of CBD and was administered to rats with water at a ratio of 22.5: 77.5 (oil / water, v / v) to achieve the same dose of CBD, oil and water across all formulations. During pharmacokinetic study, 0.3 mL blood samples were collected from jugular vein cannula at 1, 2, 3, 4, 5, 6, 8, 10 and 12 h following oral administration into EDTA-containing tubes. Collected blood samples were centrifuged at 3000 g for 10 mins at 4 \u00b0C using DLAB D1524R centrifuge (Beijing, China) for plasma separation. All samples were stored at \u221280 \u00b0C until analysis. For biodistribution studies, the rats were fasted up to 16 h with free access to water. The same formulations and doses of CBD were administered by oral gavage to rats. Blood was collected under terminal anaesthesia from inferior vena cava at the plasma tmax and tmax \u2212 1 h (determined in pharmacokinetic studies). Rats were then sacrificed, and lymph fluid sample, mesenteric lymph nodes (MLN), brain, as well as spinal cord tissues were harvested. Collected blood samples were centrifuged at 3000 g for 10 mins at 4\u00b0C using DLAB D1524R centrifuge (Beijing, China) to separate plasma. Plasma, lymph, and tissues samples were stored at \u221280\u00b0C until analysis (Zgair et al., 2017; Zgair et al., 2015). 2.11 Bioanalytical conditions The concentrations of CBD in all samples were analysed using a HPLC system consisting of Waters Alliance 2695 separations module (Milford, MA, US) and Waters photodiode array ultraviolet (PDA) 2996 detector (Milford, MA, US). The samples preparation procedure and chromatography conditions for determination of CBD were identical to a previously reported methodology (Feng et al., 2022; Feng et al., 2021a; Feng et al., 2021b; Zgair et al., 2015). 2.12 Data analysis All data are presented as mean \u00b1 standard deviation (SD). Phoenix WinNonlin 6.3 Professional (Pharsight, Mountain View, CA, US) was used for non-compartmental analysis of plasma concentration\u2013time profiles to obtain pharmacokinetic parameters. Power calculations (G*Power 3.1, Heinrich-Heine-Universit\u00e4t D\u00fcsseldorf, D\u00fcsseldorf, Germany) were used to determine the sample size of each group (Faul et al., 2007). GraphPad Prism 10.1.0 (GraphPad software, San Diego, CA, US) was used to perform statistical analysis. One-way analysis of variance (ANOVA), followed by Tukey\u2019s post-hoc comparison or unpaired t test where appropriate were used for analysis of differences between means. P < 0.05 was considered statistically significantly different. 3 Results 3.1 Physicochemical properties of CBD-loaded rapeseed oleosomes and artificial emulsion An artificial emulsion was designed to have similar physicochemical properties as rapeseed oleosomes, including particle size of around 1 \u00b5m (Fig. 2 A & 2C, Table 1 ). After CBD-loaded rapeseed oleosomes and artificial emulsion were prepared, various parameters were tested to ensure that they remain similar in their physicochemical characteristics. The particle volume distribution of CBD-loaded rapeseed oleosomes and artificial emulsion is presented in Fig. 2B showing overlapping particle size distributions. However, both CBD-loaded rapeseed oleosomes and artificial emulsion had a higher median particle size (around 2 \u00b5m) compared with unloaded lipid vehicles (Fig. 2B and Table 1). Zeta potential of these two formulations was also similar (Fig. 2D). In addition, Table 1 also shows that CBD-loaded rapeseed oleosomes and CBD-loaded artificial emulsion had practically identical CBD concentrations, while triglycerides content was already adjusted to be equivalent between these two formulations. 3.2 In vitro lipolysis of CBD-loaded rapeseed oil, rapeseed oleosomes and artificial emulsion The distribution of CBD into the sediment, aqueous micellar and oil phases following in vitro lipolysis of CBD-loaded rapeseed oil, rapeseed oleosomes and artificial emulsion is shown in Fig. 3 . The drug recovered in aqueous micellar phase is considered to be readily available for absorption. The CBD distributed more efficiently into micellar phase following lipolysis of CBD-loaded rapeseed oleosomes than following lipolysis of other formulations. The sodium hydroxide solution volumes used for titration during the lipolysis of three formulations were 0.49 \u00b1 0.02 mL, 0.26 \u00b1 0.04 mL and 0.12 \u00b1 0.00 mL (mean \u00b1 SD, rapeseed oleosome, artificial emulsion, rapeseed oil, respectively). 3.3 Peroxide value of CBD-loaded rapeseed oil and released oils from CBD-loaded rapeseed oleosomes and artificial emulsion The peroxide values of released oil from CBD-loaded rapeseed oleosomes and artificial emulsion, as well as of CBD-loaded rapeseed oil formulation were assessed (Fig. 4 ). The oil released from rapeseed oleosomes had a dramatically lower peroxide value than of other formulations. 3.4 Pharmacokinetics of CBD following oral administration in different formulations The plasma concentration\u2013time profiles of CBD following oral gavage administration of CBD-loaded rapeseed oil, artificial emulsion and rapeseed oleosomes are shown in Fig. 5 . The pharmacokinetic parameters derived from plasma concentration\u2013time profiles are shown in Table 2 . The CBD-loaded rapeseed oleosomes led to the highest systemic exposure to CBD (AUC) and highest Cmax in comparison to other formulations (2-fold increase versus rapeseed oil). Cmax was also reached faster with CBD-loaded rapeseed oleosomes (tmax = 2h) than that of CBD-loaded rapeseed oil (tmax = 5h) and artificial emulsion (tmax = 2\u20133 h). 3.5 Biodistribution of CBD following oral administration Plasma, lymph fluid, mesenteric lymph nodes (MLN), brain and spinal cord were obtained at plasma tmax and tmax \u2212 1 h following oral administration of CBD-loaded rapeseed oil, artificial emulsion and rapeseed oleosomes. The results are shown in Fig. 6 A and 6B. At plasma tmax, the CBD-loaded rapeseed oleosomes led to a significantly higher CBD concentration in MLN and lymph fluid compared with the CBD-loaded artificial emulsion and rapeseed oil (Fig. 6A). At tmax, the concentration of CBD in MLN following administration of CBD-loaded rapeseed oleosomes was 8.5-fold and 5.5-fold higher than following administration of CBD-loaded rapeseed oil or CBD-loaded artificial emulsion, respectively. In lymph fluid, CBD-loaded rapeseed oleosomes led to 26.5-fold and 9.2-fold higher CBD concentration than following CBD-loaded rapeseed oil and artificial emulsion administrations, respectively. At tmax \u2212 1 h, the concentrations of CBD in MLN and lymph fluid following oral administration of CBD-loaded rapeseed oleosomes were also higher than for other groups (Fig. 6B). However, the differences at tmax \u2212 1 h were less prominent than for plasma tmax. The distribution of CBD was also assessed in brain and spinal cord tissues and described in Supplementary Material Fig. S1. 4 Discussion Lipid-based formulations are an effective strategy to increase the intestinal lymphatic delivery and oral bioavailability of highly lipophilic drugs (Feeney et al., 2016; Hauss, 2007; Porter et al., 2007). On the example of a highly lipophilic drug CBD, we have previously shown that natural vegetable oil vehicles led to higher intestinal lymphatic delivery and systemic bioavailability than pre-digested or self-emulsifying drug delivery systems (Feng et al., 2021a; Feng et al., 2021b). However, even the best performing vegetable oil vehicles (sesame and olive oils) resulted in systemic bioavailability of CBD of only about 20 % (Feng et al., 2022; Zgair et al., 2016). Therefore, inspired by the superior performance of natural vegetable oils in comparison to artificial formulations in vivo (Feng et al., 2021a; Feng et al., 2021b), in this work we have assessed the natural seed-derived oleosomes as an oral formulation vehicle for CBD. Oleosomes are triglyceride-rich particles surrounded by phospholipid monolayer with embedded proteins, the so called oleosins. The performance of CBD-loaded rapeseed oleosomes as a formulation for lymphatic delivery and systemic bioavailability following oral administration was compared with CBD-loaded rapeseed oil and rapeseed artificial emulsion controls. 4.1 The physicochemical properties of CBD-loaded rapeseed oleosomes and artificial emulsion After drug loading and density gradient centrifugation (to remove free CBD), around 1 mg/mL CBD content was found in the CBD-loaded oleosomes with a triglyceride concentration of approximately 235 mg/mL (Table 1). To assess the possible influence of various characteristics of rapeseed oleosomes on the absorption and lymphatic delivery of CBD, a protein-free CBD-loaded artificial emulsion was developed. The CBD-loaded artificial emulsion was designed to be similar to CBD-loaded rapeseed oleosomes in terms of rapeseed oil as a lipid core, rapeseed phospholipids as surface active agents, median particle size, triglyceride levels, and CBD content (Fig. 2B, Table 1). These two formulations also showed overall similar values for their zeta-potential (Fig. 2D). However, since there is no protein in the artificial emulsions, zeta potential of the CBD-loaded artificial emulsion was slightly different from CBD-loaded rapeseed oleosomes in the pH range. Considering the acidic pH environment of gastrointestinal tract (Fallingborg, 1999; McConnell et al., 2008), this difference may slightly affect formulations\u2019 behaviour in the stomach. Additionally, another noteworthy phenomenon is the change in particle size and zeta potential before and after CBD loading. Before CBD loading, both artificial emulsion and rapeseed oleosomes had a median particle size of approximately 1 \u00b5m (Fig. 2A, Table 1). After CBD loading, their median particle size increased to around 2 \u00b5m (Fig. 2B, Table 1). Although the drug loading could be responsible for this increase the particle size, the main reason is most likely due to density gradient centrifugation, which is used to separate the formulation from the unloaded free CBD (see Supplementary Material Fig. S2). Despite particle size increase, these two formulations showed only slight changes in zeta potential before and after CBD loading (Fig. 2C & D). 4.2 CBD-loaded rapeseed oleosomes improves the intestinal lymphatic delivery and systemic bioavailability of CBD compared with CBD-loaded rapeseed oil and rapeseed artificial emulsion Oil-in-water emulsions can enhance the oral bioavailability of lipophilic drugs (McClements, 2018). However, in this work, the artificial emulsion enhanced the absorption rate and plasma Cmax in comparison to CBD-loaded pure rapeseed oil, but did not change the AUC, which represents the overall systemic exposure to the drug and its bioavailability (Fig. 5, Table 2). The CBD-loaded artificial emulsion also increased the lymphatic delivery of CBD at plasma tmax and tmax \u2212 1 h compared with rapeseed oil (Fig. 6A & 6B). Nevertheless, in comparison to rapeseed oleosomes, this improvement is not significant. The enhanced CBD absorption rate, plasma Cmax and lymphatic delivery of CBD at plasma tmax and tmax \u2212 1 h by artificial emulsion compared with rapeseed oil could be explained by the difference in their composition. The CBD-loaded rapeseed oil formulation consists only of CBD solubilised in pure oil and is not pre-emulsified. Therefore, it is likely to be digested and absorbed at a slower rate relative to the pre-emulsified formulations, which is indeed supported by the results of this study (Fig. 5). Moreover, in vitro lipolysis of the CBD-loaded rapeseed oil resulted in a substantially higher distribution of CBD into the undigested oil fraction compared with the other formulations (Fig. 3), further supporting the in vivo findings of slower absorption of CBD following administration of this formulation in comparison to pre-emulsified vehicles. On the other hand, oral administration of CBD-loaded rapeseed oleosomes resulted in the fastest CBD absorption and highest plasma Cmax, as well as substantially higher bioavailability in comparison to the other two lipid-based formulations. Importantly, CBD-loaded rapeseed oleosomes achieved significantly higher lymphatic delivery of CBD in comparison to CBD-loaded rapeseed oil or artificial emulsion (Fig. 6A & 6B). One possible explanation for the superior performance of the CBD-loaded oleosomes in comparison with the CBD-loaded artificial emulsion could be decreased coalescence of oleosomes during the early stages of digestion. As mentioned in Section 4.1, zeta potential of CBD-loaded artificial emulsion under acidic environment was lower than that of CBD-loaded rapeseed oleosomes (Fig. 2D). Since a lower absolute zeta potential value normally represent the lower stability of emulsion (Bhattacharjee, 2016; Kaszuba et al., 2010), this may lead to enhanced coalescence of the CBD-loaded artificial emulsion in the stomach. In addition, the presence of proteins on the surface of oleosomes could lead to lower coalescence (De Chirico et al., 2018; Deleu et al., 2010; Nikiforidis, 2019; Tzen and Huang, 1992; White et al., 2009). Thus, the eventual size of oleosomes\u2019 droplets within the intestinal tract in vivo might be smaller than that of the artificial emulsion and this could favour the lipolysis process by digestive lipases (Benzonana and Desnuelle, 1965). The physicochemical properties of lipid droplets appearing in the intestinal lumen can significantly affect the rate of lipid digestion and affect the bioavailability of loaded drugs (McClements, 2018; Salvia-Trujillo et al., 2013; Salvia-Trujillo et al., 2017). Smaller droplet size of the emulsion droplets often leads to faster and more complete lipid digestion, efficient formation of mixed micelles, and eventually higher bioavailability of formulated drugs (Salvia-Trujillo et al., 2013; Yi et al., 2014). Therefore, although the particle size of the CBD-loaded artificial emulsion was designed to be similar to the particle size of CBD-loaded oleosomes before administration, oleosome formulation could lead to smaller size of droplets within the gastrointestinal tract, eventually resulting in higher bioavailability and intestinal lymphatic delivery of CBD. However, there is currently a lack of direct evidence regarding the changes in particle size of these two formulations during digestion to support this hypothesis. Another potential explanation of the differences in oral bioavailability and lymphatic delivery of CBD between CBD-loaded oleosomes and artificial emulsion is that the proteins on the surface of oleosomes could influence the intraluminal digestion or affect various stages of intra-cellular assembly and release of chylomicrons. The proteins present on the oleosome membrane are mainly oleosins (15\u2013\u2013\u201320 kDa), in addition to caleosins (25\u2013\u2013\u201335 kDa), and steroleosins (> 35 kDa) (Nikiforidis, 2019). The structures of these proteins have certain similarities with surfactants \u2212 the hydrophobic domains are anchored in the triacylglycerol core, while the hydrophilic domains are exposed to the aqueous phase (Jolivet et al., 2017; Nikiforidis, 2019). Some previous studies have demonstrated that the presence and type of proteins can affect the lipolysis of emulsions in vitro (Beisson et al., 2001; Ding et al., 2021; Ding et al., 2020). In addition, Cou\u00ebdelo reported that the type of emulsifier could affect the expression of genes that are involved in absorption of fatty acids and chylomicron assembly and secretion in rats (Cou\u00ebdelo et al., 2015). These results indicate the potential role of proteins in oleosomes on the absorption of CBD. An in vitro model of lipid digestion was used to explore what might be occurring during the digestion of CBD-loaded lipid droplets in rats (Fig. 3). During lipolysis, substantially higher amount of sodium hydroxide solution was consumed during the digestion of the CBD-loaded rapeseed oleosomes in comparison with the CBD-loaded artificial emulsion and CBD-loaded rapeseed oil (0.49 \u00b1 0.02 mL, 0.26 \u00b1 0.04 mL and 0.12 \u00b1 0.00 mL, mean \u00b1 SD,respectively). This leads to an estimated hydrolysis levels of these three formulations of 68.34 \u00b1 2.79 %, 36.21 \u00b1 5.57 % and 16.76 \u00b1 0.56 % (mean \u00b1 SD, CBD-loaded rapeseed oleosomes, artificial emulsion and rapeseed oil, respectively). This means that the CBD-loaded oleosomes were hydrolysed most efficiently in comparison with the artificial emulsion and rapeseed oil systems. The hydrolysis level reached with rapeseed oleosomes corresponds to the release of two fatty acids out of the three esterified in rapeseed triglycerides, i.e. the complete conversion of triglycerides into free fatty acids and monoglycerides. This suggests that the lipids initially present in the oleosomes could be all transferred to the micellar phase where they can contribute to the formation of mixed micelles with bile salts and phospholipids. The process could increase the micellar solubilization of CBD and, indeed, the highest level of CBD in the micellar phase is observed with CBD-loaded oleosomes (Fig. 3). However, on this important parameter \u2212 the CBD distribution fraction, the performance of CBD-loaded rapeseed oleosomes did not differ significantly from CBD-loaded artificial emulsion. The lipolysis of the CBD-loaded oleosomes led to \u223c 90 % of CBD distribution into micellar phase and very little CBD was left for the undigested oil phase (very little volume of oil left). For artificial emulsion, the CBD distribution into micellar phase and oil phase was \u223c 80 % and \u223c 10 %, respectively. Moreover, this in vitro lipolysis model only simulates the pre-enterocyte intestinal digestion processes. Since CBD is a highly lipophilic molecule, its oral bioavailability is greatly affected by the intestinal lymphatic transport, which is associated with affinity to chylomicrons in the enterocytes. It has been suggested previously that in vitro lipolysis models might be not predictive for oral bioavailability of drugs with substantial intestinal lymphatic transport component in their absorption following oral administration (Chu et al., 2023; Dahan and Hoffman, 2008). These considerations suggest that differences in intraluminal digestion of these two formulations could partially contribute to the differences in oral bioavailability and lymphatic delivery of CBD. It is, however, unlikely, that the observed differences in CBD distribution into micellar, oil and sediment phases following the in vitro lipolysis can fully explain the substantially higher lymphatic delivery and bioavailability of CBD following oral administration of CBD-loaded oleosomes in vivo. In addition, there is still insufficient evidence to explain how the hydrolysis rate of triglycerides could make an impact on the distribution of CBD. Another hypothesis is that the oxidation level of lipids in the formulation could affect the oral bioavailability and lymphatic delivery of CBD. Polyunsaturated oils are prone to formation of peroxides during processing and storage and could potentially also undergo oxidation in the gastrointestinal tract following administration (Nieva-Echevarr\u00eda et al., 2020). The initial oxidation of lipids may lead to reduced lipolysis (Martin-Rubio et al., 2019). This could explain at least partially the sodium hydroxide titration volume differences during lipolysis. On the other side, the oxidation level of lipids could substantially affect the digestion and absorption of lipids and the bioavailability of lipophilic drugs (M\u00e1rquez-Ruiz et al., 2008; Yao et al., 2022). It was reported that the quantity and morphology of lipoprotein particles produced by intestinal epithelial cells depends on the oxidation state of the administered lipids, with oxidized lipids leading to smaller and more irregularly shaped lipoproteins (Yao et al., 2022). In addition, exposure to oxidized lipids might adversely affect the intestinal epithelial cells and subsequently influence the absorption of lipophilic substances (Yao et al., 2022). Furthermore, the oxidation of oil could also affect the minor constituents present in the natural oils, such as sterols and phenolic compounds (M\u00e1rquez-Ruiz et al., 2008). The presence of these minor constituents could be one of the factors responsible for higher oral bioavailability and lymphatic delivery of CBD observed with natural vegetables oils in comparison to pre-digested or other artificial formulations (Feng et al., 2021a). To test this hypothesis, the lipids in the three formulations were extracted and the peroxide value was assessed (Fig. 4). The results show that the oil from CBD-loaded rapeseed oleosomes has dramatically lower peroxide value (\u223c0.6 meq/kg) than that from the CBD-loaded artificial emulsion (\u223c22.0 meq/kg). The peroxide value of CBD-loaded rapeseed oil is close to the oil from CBD-loaded artificial emulsion (\u223c18.6 meq/kg). Given the dramatic difference in the peroxide values of the oil content of the CBD-loaded rapeseed oil, artificial emulsion and oleosomes, degree of oxidation of lipids could be an important factor for the differences observed in the lymphatic delivery and bioavailability of CBD. Further research will be needed to confirm or reject this hypothesis, as well as for mechanistic investigation of how the degree of oxidation affects the digestion of lipids, the bioavailability and lymphatic delivery of lipophilic drugs. 5 Conclusion CBD has low oral bioavailability due to its high lipophilicity and extensive first-pass metabolic loss. Lipid-based formulations containing long-chain triglyceride or long-chain fatty acids are an effective strategy to facilitate the intestinal lymphatic delivery and enhance oral bioavailability of this lipophilic drug. Our previous work suggests that natural vegetable oils lead to higher lymphatic delivery and systemic bioavailability of CBD in comparison to pre-digested or self-emulsifying artificial formulations. In this work, we have developed a novel formulation of CBD based on natural rapeseed oleosomes and compared its CBD delivery performance to pure rapeseed oil and artificial oleosome-like rapeseed-based emulsion. The CBD-loaded rapeseed oleosomes led to substantially higher lymphatic delivery and systemic bioavailability of CBD in comparison with artificial rapeseed oil emulsion (stabilised with rapeseed phosphatidylcholine) or non-emulsified rapeseed oil. The lower oxidation level of the oil in oleosomes could be an important factor for the observed superior performance of natural oleosomes. Other potential explanations could include differences in intraluminal stability post-administration, influence of the surface proteins during the intraluminal digestion or the assembly and release of chylomicrons, or the lipolysis efficiency of the lipid vehicles. Further investigation is necessary to confirm or reject these hypothesises, as well as for mechanistic investigation on how the degree of oxidation, the presence of protein and other factors affect the digestion of lipids, the bioavailability and lymphatic delivery of CBD and other lipophilic drugs. CRediT authorship contribution statement Liuhang Ji: Writing \u2013 original draft, Methodology, Investigation. Wanshan Feng: Writing \u2013 review & editing, Methodology, Investigation. Haojie Chen: Writing \u2013 review & editing, Methodology, Investigation. YenJu Chu: Writing \u2013 review & editing, Methodology, Investigation. Abigail Wong: Writing \u2013 review & editing, Methodology, Investigation. Yufei Zhu: Writing \u2013 review & editing, Methodology, Investigation. Graziamarina Sinatra: Writing \u2013 review & editing, Methodology, Investigation. Filippo Bramante: Writing \u2013 review & editing, Methodology, Investigation. Fr\u00e9d\u00e9ric Carri\u00e8re: Writing \u2013 review & editing, Validation. Michael J. Stocks: Writing \u2013 review & editing, Supervision, Methodology, Investigation. Vincenzo di Bari: Writing \u2013 review & editing. David A. Gray: Writing \u2013 review & editing, Supervision, Methodology, Investigation, Data curation, Conceptualization. Pavel Gershkovich: Writing \u2013 review & editing, Supervision, Resources, Project administration, Methodology, Investigation, Funding acquisition, Data curation, Conceptualization. Declaration of competing interest The authors declare that they have no known competing financial interests or personal relationships that could have appeared to influence the work reported in this paper. Acknowledgements This work was supported by Rosetrees Trust and Stoneygate Trust [grant number M902]. The authors would like to acknowledge the CBDepot.eu for their kind donation of synthetic CBD. The authors also would like to thank the Bio-Support Unit (BSU) team in the University of Nottingham for excellent technical assistance. Appendix A Supplementary data Supplementary data to this article can be found online at https://doi.org/10.1016/j.ijpharm.2024.124947. Appendix A Supplementary data The following are the Supplementary data to this article: Supplementary Data 1 References Alice Brookes et al., 2024 N.K. Alice Brookes D.J. Scurr M.R. Alexander P. Gershkovich T.D. Bradshaw Cannabidiol and fluorinated derivative anti-cancer properties against glioblastoma multiforme cell lines, and synergy with imidazotetrazine agents BJC Reports 2024 10.21203/rs.3.rs-3639079/v1 Alice Brookes, N.K., David J. Scurr, Morgan R. Alexander, Pavel Gershkovich, Tracey D. Bradshaw, 2024. Cannabidiol and fluorinated derivative anti-cancer properties against glioblastoma multiforme cell lines, and synergy with imidazotetrazine agents. BJC Reports. doi: 10.21203/rs.3.rs-3639079/v1. Arzimanoglou et al., 2020 A. Arzimanoglou U. Brandl J.H. Cross A. Gil-Nagel L. Lagae C.J. Landmark N. Specchio R. Nabbout E.A. Thiele O. Gubbay Epilepsy and cannabidiol: a guide to treatment Epileptic Disorders 22 2020 1 14 10.1684/epd.2020.1141 Arzimanoglou, A., Brandl, U., Cross, J.H., Gil-Nagel, A., Lagae, L., Landmark, C.J., Specchio, N., Nabbout, R., Thiele, E.A. and Gubbay, O., 2020. Epilepsy and cannabidiol: a guide to treatment. Epileptic Disorders 22, 1-14. https://doi.org/10.1684/epd.2020.1141 Beisson et al., 2001 F. Beisson N. Fert\u00e9 S. Bruley R. Voultoury R. Verger V. Arondel Oil-bodies as substrates for lipolytic enzymes Biochimica et Biophysica Acta (BBA)-Molecular and Cell Biology of Lipids 1531 2001 47 58 10.1016/S1388-1981(01)00086-5 Beisson, F., Fert\u00e9, N., Bruley, S., Voultoury, R., Verger, R., Arondel, V., 2001. Oil-bodies as substrates for lipolytic enzymes. Biochimica et Biophysica Acta (BBA)-Molecular and Cell Biology of Lipids 1531, 47-58. doi: 10.1016/S1388-1981(01)00086-5. Benito-Gallo et al., 2015 P. Benito-Gallo A. Franceschetto J.C.M. Wong M. Marlow V. Zann P. Scholes P. Gershkovich Chain length affects pancreatic lipase activity and the extent and pH\u2013time profile of triglyceride lipolysis European Journal of Pharmaceutics and Biopharmaceutics 93 2015 353 362 10.1016/j.ejpb.2015.04.027 Benito-Gallo, P., Franceschetto, A., Wong, J.C.M., Marlow, M., Zann, V., Scholes, P., Gershkovich, P., 2015. Chain length affects pancreatic lipase activity and the extent and pH\u2013time profile of triglyceride lipolysis. European Journal of Pharmaceutics and Biopharmaceutics 93, 353-362. doi: 10.1016/j.ejpb.2015.04.027. Benito-Gallo et al., 2016 P. Benito-Gallo M. Marlow V. Zann P. Scholes P. Gershkovich Linking in vitro lipolysis and microsomal metabolism for the quantitative prediction of oral bioavailability of BCS II drugs administered in lipidic formulations Molecular Pharmaceutics 13 2016 3526 3540 10.1021/acs.molpharmaceut.6b00597 Benito-Gallo, P., Marlow, M., Zann, V., Scholes, P., Gershkovich, P., 2016. Linking in Vitro Lipolysis and Microsomal Metabolism for the Quantitative Prediction of Oral Bioavailability of BCS II Drugs Administered in Lipidic Formulations. Molecular Pharmaceutics 13, 3526-3540. doi: 10.1021/acs.molpharmaceut.6b00597. Benzonana and Desnuelle, 1965 G. Benzonana P. Desnuelle Kinetic study of the action of pancreatic lipase on emulsified triglycerides. Enzymology assay in heterogeneous medium Biochimica et Biophysica Acta 105 1965 121 136 https://pubmed.ncbi.nlm.nih.gov/5849108/ Benzonana, G., Desnuelle, P., 1965. Kinetic study of the action of pancreatic lipase on emulsified triglycerides. Enzymology assay in heterogeneous medium. Biochimica et Biophysica Acta 105, 121-136. https://pubmed.ncbi.nlm.nih.gov/5849108/. Bhattacharjee, 2016 S. Bhattacharjee DLS and zeta potential \u2013 What they are and what they are not? Journal of Controlled Release 235 2016 337 351 10.1016/j.jconrel.2016.06.017 Bhattacharjee, S., 2016. DLS and zeta potential \u2013 What they are and what they are not? Journal of Controlled Release 235, 337-351. doi: 10.1016/j.jconrel.2016.06.017. Carri\u00e8re, 2016 F. Carri\u00e8re Impact of gastrointestinal lipolysis on oral lipid-based formulations and bioavailability of lipophilic drugs Biochimie 125 2016 297 305 10.1016/j.biochi.2015.11.016 Carri\u00e8re, F., 2016. Impact of gastrointestinal lipolysis on oral lipid-based formulations and bioavailability of lipophilic drugs. Biochimie 125, 297-305. doi: 10.1016/j.biochi.2015.11.016. Chen et al., 2018 K.-A. Chen M. Farrar M. Cardamone D. Gill R. Smith C.T. Cowell L. Truong J.A. Lawson Cannabidiol for treating drug-resistant epilepsy in children: the New South Wales experience Medical Journal of Australia 209 2018 217 221 10.5694/mja18.00023 Chen, K.-A., Farrar, M., Cardamone, M., Gill, D., Smith, R., Cowell, C.T., Truong, L., Lawson, J.A., 2018. Cannabidiol for treating drug-resistant epilepsy in children: the New South Wales experience. Medical Journal of Australia 209, 217-221. doi: 10.5694/mja18.00023. Cho et al., 2018 H.-Y. Cho T. Lee J. Yoon Z. Han H. Rabie K.-B. Lee W.W. Su J.-W. Choi Magnetic oleosome as a functional lipophilic drug carrier for cancer therapy ACS Applied Materials & Interfaces 10 2018 9301 9309 10.1021/acsami.7b19255 Cho, H.-Y., Lee, T., Yoon, J., Han, Z., Rabie, H., Lee, K.-B., Su, W.W., Choi, J.-W., 2018. Magnetic Oleosome as a Functional Lipophilic Drug Carrier for Cancer Therapy. ACS Applied Materials & Interfaces 10, 9301-9309. doi: 10.1021/acsami.7b19255. Chu et al., 2023 Y. Chu A. Wong H. Chen L. Ji C. Qin W. Feng M.J. Stocks P. Gershkovich Development of lipophilic ester prodrugs of dolutegravir for intestinal lymphatic transport European Journal of Pharmaceutics and Biopharmaceutics 191 2023 90 102 10.1016/j.ejpb.2023.08.015 Chu, Y., Wong, A., Chen, H., Ji, L., Qin, C., Feng, W., Stocks, M.J., Gershkovich, P., 2023. Development of lipophilic ester prodrugs of dolutegravir for intestinal lymphatic transport. European Journal of Pharmaceutics and Biopharmaceutics 191, 90-102. doi: 10.1016/j.ejpb.2023.08.015. Cou\u00ebdelo et al., 2015 L. Cou\u00ebdelo S. Amara M. Lecomte E. Meugnier J. Monteil L. Fonseca G. Pineau M. Cansell F. Carriere M.-C. Michalski Impact of various emulsifiers on ALA bioavailability and chylomicron synthesis through changes in gastrointestinal lipolysis Food & Function 6 2015 1726 1735 10.1039/C5FO00070J Cou\u00ebdelo, L., Amara, S., Lecomte, M., Meugnier, E., Monteil, J., Fonseca, L., Pineau, G., Cansell, M., Carriere, F., Michalski, M.-C., 2015. Impact of various emulsifiers on ALA bioavailability and chylomicron synthesis through changes in gastrointestinal lipolysis. Food & function 6, 1726-1735. doi: 10.1039/C5FO00070J. Court et al., 2024 M.H. Court K.L. Mealey N.S. Burke T.P. Jimenez Z. Zhu J.J. Wakshlag Cannabidiol and cannabidiolic acid: Preliminary in vitro evaluation of metabolism and drug\u2013drug interactions involving canine cytochrome P\u2010450, UDP\u2010glucuronosyltransferase, and P\u2010glycoprotein Journal of Veterinary Pharmacology and Therapeutics 47 2024 1 13 10.1111/jvp.13403 Court, M.H., Mealey, K.L., Burke, N.S., Jimenez, T.P., Zhu, Z., Wakshlag, J.J., 2024. Cannabidiol and cannabidiolic acid: Preliminary in vitro evaluation of metabolism and drug\u2013drug interactions involving canine cytochrome P\u2010450, UDP\u2010glucuronosyltransferase, and P\u2010glycoprotein. Journal of Veterinary Pharmacology and Therapeutics 47, 1-13. doi: 10.1111/jvp.13403. Dahan and Hoffman, 2008 A. Dahan A. Hoffman Rationalizing the selection of oral lipid based drug delivery systems by an in vitro dynamic lipolysis model for improved oral bioavailability of poorly water soluble drugs Journal of Controlled Release 129 2008 1 10 10.1016/j.jconrel.2008.03.021 Dahan, A., Hoffman, A., 2008. Rationalizing the selection of oral lipid based drug delivery systems by an in vitro dynamic lipolysis model for improved oral bioavailability of poorly water soluble drugs. Journal of Controlled Release 129, 1-10. doi: 10.1016/j.jconrel.2008.03.021. De Chirico et al., 2018 S. De Chirico V. di Bari T. Foster D. Gray Enhancing the recovery of oilseed rape seed oil bodies (oleosomes) using bicarbonate-based soaking and grinding media Food Chemistry 241 2018 419 426 10.1016/j.foodchem.2017.09.008 De Chirico, S., di Bari, V., Foster, T., Gray, D., 2018. Enhancing the recovery of oilseed rape seed oil bodies (oleosomes) using bicarbonate-based soaking and grinding media. Food Chemistry 241, 419-426. doi: 10.1016/j.foodchem.2017.09.008. Deleu et al., 2010 M. Deleu G. Vaca-Medina J.-F. Fabre J. Ro\u00efz R. Valentin Z. Mouloungui Interfacial properties of oleosins and phospholipids from rapeseed for the stability of oil bodies in aqueous medium Colloids and Surfaces B: Biointerfaces 80 2010 125 132 10.1016/j.colsurfb.2010.05.036 Deleu, M., Vaca-Medina, G., Fabre, J.-F., Ro\u00efz, J., Valentin, R., Mouloungui, Z., 2010. Interfacial properties of oleosins and phospholipids from rapeseed for the stability of oil bodies in aqueous medium. Colloids and Surfaces B: Biointerfaces 80, 125-132. doi: 10.1016/j.colsurfb.2010.05.036. Ding et al., 2020 J. Ding J. Wen J. Wang R. Tian L. Yu L. Jiang Y. Zhang X. Sui The physicochemical properties and gastrointestinal fate of oleosomes from non-heated and heated soymilk Food Hydrocolloids 100 2020 105418 10.1016/j.foodhyd.2019.105418 Ding, J., Wen, J., Wang, J., Tian, R., Yu, L., Jiang, L., Zhang, Y., Sui, X., 2020. The physicochemical properties and gastrointestinal fate of oleosomes from non-heated and heated soymilk. Food Hydrocolloids 100, 105418. doi: 10.1016/j.foodhyd.2019.105418. Ding et al., 2021 J. Ding Y. Dong G. Huang Y. Zhang L. Jiang X. Sui Fabrication and characterization of \u03b2-carotene emulsions stabilized by soy oleosin and lecithin mixtures with a composition mimicking natural soy oleosomes Food & Function 12 2021 10875 10886 10.1039/D1FO01462E Ding, J., Dong, Y., Huang, G., Zhang, Y., Jiang, L., Sui, X., 2021. Fabrication and characterization of \u03b2-carotene emulsions stabilized by soy oleosin and lecithin mixtures with a composition mimicking natural soy oleosomes. Food & Function 12, 10875-10886. doi: 10.1039/D1FO01462E. Fallingborg, 1999 J. Fallingborg Intraluminal pH of the human gastrointestinal tract Danish Medical Bulletin 46 1999 183 196 https://pubmed.ncbi.nlm.nih.gov/10421978/ Fallingborg, J., 1999. Intraluminal pH of the human gastrointestinal tract. Danish medical bulletin 46, 183-196. https://pubmed.ncbi.nlm.nih.gov/10421978/. Faul et al., 2007 F. Faul E. Erdfelder A.-G. Lang A. Buchner G* Power 3: A flexible statistical power analysis program for the social, behavioral, and biomedical sciences Behavior Research Methods 39 2007 175 191 Faul, F., Erdfelder, E., Lang, A.-G., Buchner, A., 2007. G* Power 3: A flexible statistical power analysis program for the social, behavioral, and biomedical sciences. Behavior research methods 39, 175-191. Feeney et al., 2016 O.M. Feeney M.F. Crum C.L. McEvoy N.L. Trevaskis H.D. Williams C.W. Pouton W.N. Charman C.A. Bergstr\u00f6m C.J. Porter 50 years of oral lipid-based formulations: provenance, progress and future perspectives Advanced Drug Delivery Reviews 101 2016 167 194 10.1016/j.addr.2016.04.007 Feeney, O.M., Crum, M.F., McEvoy, C.L., Trevaskis, N.L., Williams, H.D., Pouton, C.W., Charman, W.N., Bergstr\u00f6m, C.A., Porter, C.J., 2016. 50 years of oral lipid-based formulations: provenance, progress and future perspectives. Advanced drug delivery reviews 101, 167-194. doi: 10.1016/j.addr.2016.04.007. Feng et al., 2021a W. Feng C. Qin Y. Chu M. Berton J.B. Lee A. Zgair S. Bettonte M.J. Stocks C.S. Constantinescu D.A. Barrett P.M. Fischer P. Gershkovich Natural sesame oil is superior to pre-digested lipid formulations and purified triglycerides in promoting the intestinal lymphatic transport and systemic bioavailability of cannabidiol European Journal of Pharmaceutics and Biopharmaceutics 162 2021 43 49 10.1016/j.ejpb.2021.02.013 Feng, W., Qin, C., Chu, Y., Berton, M., Lee, J.B., Zgair, A., Bettonte, S., Stocks, M.J., Constantinescu, C.S., Barrett, D.A., Fischer, P.M., Gershkovich, P., 2021a. Natural sesame oil is superior to pre-digested lipid formulations and purified triglycerides in promoting the intestinal lymphatic transport and systemic bioavailability of cannabidiol. European Journal of Pharmaceutics and Biopharmaceutics 162, 43-49. doi: 10.1016/j.ejpb.2021.02.013. Feng et al., 2021b W. Feng C. Qin E. Cipolla J.B. Lee A. Zgair Y. Chu C.A. Ortori M.J. Stocks C.S. Constantinescu D.A. Barrett P.M. Fischer P. Gershkovich Inclusion of medium-chain triglyceride in lipid-based formulation of cannabidiol facilitates micellar solubilization in vitro, but in vivo performance remains superior with pure sesame oil vehicle Pharmaceutics 13 2021 1349 10.3390/pharmaceutics13091349 Feng, W., Qin, C., Cipolla, E., Lee, J.B., Zgair, A., Chu, Y., Ortori, C.A., Stocks, M.J., Constantinescu, C.S., Barrett, D.A., Fischer, P.M., Gershkovich, P., 2021b. Inclusion of Medium-Chain Triglyceride in Lipid-Based Formulation of Cannabidiol Facilitates Micellar Solubilization In Vitro, but In Vivo Performance Remains Superior with Pure Sesame Oil Vehicle. Pharmaceutics 13, 1349. doi: 10.3390/pharmaceutics13091349. Feng et al., 2022 W. Feng C. Qin S. Abdelrazig Z. Bai M. Raji R. Darwish Y. Chu L. Ji D.A. Gray M.J. Stocks C.S. Constantinescu D.A. Barrett P.M. Fischer P. Gershkovich Vegetable oils composition affects the intestinal lymphatic transport and systemic bioavailability of co-administered lipophilic drug cannabidiol International Journal of Pharmaceutics 624 2022 121947 10.1016/j.ijpharm.2022.121947 Feng, W., Qin, C., Abdelrazig, S., Bai, Z., Raji, M., Darwish, R., Chu, Y., Ji, L., Gray, D.A., Stocks, M.J., Constantinescu, C.S., Barrett, D.A., Fischer, P.M., Gershkovich, P., 2022. Vegetable oils composition affects the intestinal lymphatic transport and systemic bioavailability of co-administered lipophilic drug cannabidiol. International Journal of Pharmaceutics 624, 121947. doi: 10.1016/j.ijpharm.2022.121947. Franco et al., 2020 V. Franco P. Gershkovich E. Perucca M. Bialer The interplay between liver first-pass effect and lymphatic absorption of cannabidiol and its implications for cannabidiol oral formulations Clinical Pharmacokinetics 59 2020 1493 1500 10.1007/s40262-020-00931-w Franco, V., Gershkovich, P., Perucca, E., Bialer, M., 2020. The interplay between liver first-pass effect and lymphatic absorption of cannabidiol and its implications for cannabidiol oral formulations. Clinical Pharmacokinetics 59, 1493-1500. doi: 10.1007/s40262-020-00931-w. Gershkovich and Hoffman, 2005 P. Gershkovich A. Hoffman Uptake of lipophilic drugs by plasma derived isolated chylomicrons: Linear correlation with intestinal lymphatic bioavailability European Journal of Pharmaceutical Sciences 26 2005 394 404 10.1016/j.ejps.2005.07.011 Gershkovich, P., Hoffman, A., 2005. Uptake of lipophilic drugs by plasma derived isolated chylomicrons: Linear correlation with intestinal lymphatic bioavailability. European Journal of Pharmaceutical Sciences 26, 394-404. doi: 10.1016/j.ejps.2005.07.011. Gershkovich et al., 2012 P. Gershkovich O. Sivak S. Contreras-Whitney J.W. Darlington K.M. Wasan Assessment of cholesterol absorption inhibitors nanostructured aluminosilicate and cholestyramine using in vitro lipolysis model Journal of Pharmaceutical Sciences 101 2012 291 300 10.1002/jps.22770 Gershkovich, P., Sivak, O., Contreras-Whitney, S., Darlington, J.W., Wasan, K.M., 2012. Assessment of Cholesterol Absorption Inhibitors Nanostructured Aluminosilicate and Cholestyramine Using In Vitro Lipolysis Model. Journal of Pharmaceutical Sciences 101, 291-300. doi: 10.1002/jps.22770. Hauss, 2007 D.J. Hauss Oral lipid-based formulations Advanced Drug Delivery Reviews 59 2007 667 676 10.1016/j.addr.2007.05.006 Hauss, D.J., 2007. Oral lipid-based formulations. Advanced drug delivery reviews 59, 667-676. doi: 10.1016/j.addr.2007.05.006. Hess et al., 2016 E.J. Hess K.A. Moody A.L. Geffrey S.F. Pollack L.A. Skirvin P.L. Bruno J.L. Paolini E.A. Thiele Cannabidiol as a new treatment for drug\u2010resistant epilepsy in tuberous sclerosis complex Epilepsia 57 2016 1617 1624 10.1111/epi.13499 Hess, E.J., Moody, K.A., Geffrey, A.L., Pollack, S.F., Skirvin, L.A., Bruno, P.L., Paolini, J.L., Thiele, E.A., 2016. Cannabidiol as a new treatment for drug\u2010resistant epilepsy in tuberous sclerosis complex. Epilepsia 57, 1617-1624. doi: 10.1111/epi.13499. Hoffenberg et al., 2019 E.J. Hoffenberg S. McWilliams S. Mikulich-Gilbertson B. Murphy A. Hoffenberg C.J. Hopfer Cannabis oil use by adolescents and young adults with inflammatory bowel disease Journal of Pediatric Gastroenterology and Nutrition 68 2019 10.1097/mpg.0000000000002189 Hoffenberg, E.J., McWilliams, S., Mikulich-Gilbertson, S., Murphy, B., Hoffenberg, A., Hopfer, C.J., 2019. Cannabis Oil Use by Adolescents and Young Adults With Inflammatory Bowel Disease. Journal of Pediatric Gastroenterology and Nutrition 68. doi: 10.1097/mpg.0000000000002189 Jiang et al., 2011 R. Jiang S. Yamaori S. Takeda I. Yamamoto K. Watanabe Identification of cytochrome P450 enzymes responsible for metabolism of cannabidiol by human liver microsomes Life Sciences 89 2011 165 170 10.1016/j.lfs.2011.05.018 Jiang, R., Yamaori, S., Takeda, S., Yamamoto, I., Watanabe, K., 2011. Identification of cytochrome P450 enzymes responsible for metabolism of cannabidiol by human liver microsomes. Life Sciences 89, 165-170. doi: 10.1016/j.lfs.2011.05.018. Jolivet et al., 2017 P. Jolivet L. Aym\u00e9 A. Giuliani F. Wien T. Chardot Y. Gohon Structural proteomics: Topology and relative accessibility of plant lipid droplet associated proteins Journal of Proteomics 169 2017 87 98 10.1016/j.jprot.2017.09.005 Jolivet, P., Aym\u00e9, L., Giuliani, A., Wien, F., Chardot, T., Gohon, Y., 2017. Structural proteomics: Topology and relative accessibility of plant lipid droplet associated proteins. Journal of Proteomics 169, 87-98. doi: 10.1016/j.jprot.2017.09.005. Kalepu et al., 2013 S. Kalepu M. Manthina V. Padavala Oral lipid-based drug delivery systems\u2013an overview Acta Pharmaceutica Sinica B 3 2013 361 372 10.1016/j.apsb.2013.10.001 Kalepu, S., Manthina, M., Padavala, V., 2013. Oral lipid-based drug delivery systems\u2013an overview. Acta Pharmaceutica Sinica B 3, 361-372. doi: 10.1016/j.apsb.2013.10.001. Kaszuba et al., 2010 M. Kaszuba J. Corbett F.M. Watson A. Jones High-concentration zeta potential measurements using light-scattering techniques Philosophical Transactions of the Royal Society A: Mathematical, Physical and Engineering Sciences 368 2010 4439 4451 10.1098/rsta.2010.0175 Kaszuba, M., Corbett, J., Watson, F.M., Jones, A., 2010. High-concentration zeta potential measurements using light-scattering techniques. Philosophical Transactions of the Royal Society A: Mathematical, Physical and Engineering Sciences 368, 4439-4451. Doi: 10.1098/rsta.2010.0175. M\u00e1rquez-Ruiz et al., 2008 G. M\u00e1rquez-Ruiz M. Garc\u00eda-Mart\u00ednez F. Holgado Changes and effects of dietary oxidized lipids in the gastrointestinal tract Lipid Insights 2 2008 LPI. S904 10.4137/LPI.S904 M\u00e1rquez-Ruiz, G., Garc\u00eda-Mart\u00ednez, M., Holgado, F., 2008. Changes and effects of dietary oxidized lipids in the gastrointestinal tract. Lipid Insights 2, LPI. S904. doi: 10.4137/LPI.S904. Martin-Rubio et al., 2019 A.S. Martin-Rubio P. Sopelana M. Guill\u00e9n The key role of ovalbumin in lipid bioaccessibility and oxidation product profile during the in vitro digestion of slightly oxidized soybean oil Food & Function 10 2019 4440 4451 10.1039/C9FO00598F Martin-Rubio, A.S., Sopelana, P., Guill\u00e9n, M., 2019. The key role of ovalbumin in lipid bioaccessibility and oxidation product profile during the in vitro digestion of slightly oxidized soybean oil. Food & Function 10, 4440-4451. doi: 10.1039/C9FO00598F. McClements, 2018 D.J. McClements Enhanced delivery of lipophilic bioactives using emulsions: a review of major factors affecting vitamin, nutraceutical, and lipid bioaccessibility Food & Function 9 2018 22 41 10.1039/c7fo01515a McClements, D.J., 2018. Enhanced delivery of lipophilic bioactives using emulsions: a review of major factors affecting vitamin, nutraceutical, and lipid bioaccessibility. Food & Function 9, 22-41. doi: 10.1039/c7fo01515a. McConnell et al., 2008 E.L. McConnell A.W. Basit S. Murdan Measurements of rat and mouse gastrointestinal pH, fluid and lymphoid tissue, and implications for in\u2010vivo experiments Journal of Pharmacy and Pharmacology 60 2008 63 70 10.1211/jpp.60.1.0008 McConnell, E.L., Basit, A.W., Murdan, S., 2008. Measurements of rat and mouse gastrointestinal pH, fluid and lymphoid tissue, and implications for in\u2010vivo experiments. Journal of Pharmacy and Pharmacology 60, 63-70. doi: 10.1211/jpp.60.1.0008. Mechoulam et al., 2002 R. Mechoulam L.A. Parker R. Gallily Cannabidiol: an overview of some pharmacological aspects The Journal of Clinical Pharmacology 42 2002 11S S19 10.1002/j.1552-4604.2002.tb05998.x Mechoulam, R., Parker, L.A., Gallily, R., 2002. Cannabidiol: an overview of some pharmacological aspects. The Journal of Clinical Pharmacology 42, 11S-19S. doi: 10.1002/j.1552-4604.2002.tb05998.x. Muresan et al., 2023 P. Muresan S. Woodhams F. Smith V. Taresco J. Shah M. Wong V. Chapman S. Smith G. Hathway R. Rahman P. Gershkovich M. Marlow Evaluation of cannabidiol nanoparticles and nanoemulsion biodistribution in the central nervous system after intrathecal administration for the treatment of pain Nanomedicine: Nanotechnology, Biology and Medicine 49 2023 102664 10.1016/j.nano.2023.102664 Muresan, P., Woodhams, S., Smith, F., Taresco, V., Shah, J., Wong, M., Chapman, V., Smith, S., Hathway, G., Rahman, R., Gershkovich, P., Marlow, M., 2023. Evaluation of cannabidiol nanoparticles and nanoemulsion biodistribution in the central nervous system after intrathecal administration for the treatment of pain. Nanomedicine: Nanotechnology, Biology and Medicine 49, 102664. doi: 10.1016/j.nano.2023.102664. Nichols and Kaplan, 2019 J.M. Nichols B.L.F. Kaplan Immune responses regulated by cannabidiol Cannabis and Cannabinoid Research 5 2019 12 31 10.1089/can.2018.0073 Nichols, J.M., Kaplan, B.L.F., 2019. Immune Responses Regulated by Cannabidiol. Cannabis and Cannabinoid Research 5, 12-31. doi: 10.1089/can.2018.0073. Nieva-Echevarr\u00eda et al., 2020 B. Nieva-Echevarr\u00eda E. Goicoechea M.D. Guill\u00e9n Food lipid oxidation under gastrointestinal digestion conditions: A review Critical Reviews in Food Science and Nutrition 60 2020 461 478 10.1080/10408398.2018.1538931 Nieva-Echevarr\u00eda, B., Goicoechea, E., Guill\u00e9n, M.D., 2020. Food lipid oxidation under gastrointestinal digestion conditions: A review. Critical Reviews in Food Science and Nutrition 60, 461-478. doi: 10.1080/10408398.2018.1538931. Nikiforidis, 2019 C.V. Nikiforidis Structure and functions of oleosomes (oil bodies) Advances in Colloid and Interface Science 274 2019 102039 10.1016/j.cis.2019.102039 Nikiforidis, C.V., 2019. Structure and functions of oleosomes (oil bodies). Advances in Colloid and Interface Science 274, 102039. doi: 10.1016/j.cis.2019.102039. Perucca and Bialer, 2020 E. Perucca M. Bialer Critical aspects affecting cannabidiol oral bioavailability and metabolic elimination, and related clinical implications CNS Drugs 34 2020 795 800 10.1007/s40263-020-00741-5 Perucca, E., Bialer, M., 2020. Critical Aspects Affecting Cannabidiol Oral Bioavailability and Metabolic Elimination, and Related Clinical Implications. CNS Drugs 34, 795-800. Https://10.1007/s40263-020-00741-5. Porter et al., 2007 C.J. Porter N.L. Trevaskis W.N. Charman Lipids and lipid-based formulations: optimizing the oral delivery of lipophilic drugs Nature Reviews Drug Discovery 6 2007 231 248 10.1038/nrd2197 Porter, C.J., Trevaskis, N.L., Charman, W.N., 2007. Lipids and lipid-based formulations: optimizing the oral delivery of lipophilic drugs. Nature reviews Drug discovery 6, 231-248. doi: 10.1038/nrd2197. Porter et al., 2013 C.J. Porter H.D. Williams N.L. Trevaskis Recent advances in lipid-based formulation technology Pharmaceutical Research 30 2013 2971 2975 10.1007/s11095-013-1229-7 Porter, C.J., Williams, H.D., Trevaskis, N.L., 2013. Recent advances in lipid-based formulation technology. Pharmaceutical research 30, 2971-2975. doi: 10.1007/s11095-013-1229-7. Qin et al., 2021 C. Qin Y. Chu W. Feng C. Fromont S. He J. Ali J.B. Lee A. Zgair M. Berton S. Bettonte R. Liu L. Yang T. Monmaturapoj C. Medrano-Padial A.A.R. Ugalde D. Vetrugno S.Y. Ee C. Sheriston Y. Wu M.J. Stocks P.M. Fischer P. Gershkovich Targeted delivery of lopinavir to HIV reservoirs in the mesenteric lymphatic system by lipophilic ester prodrug approach Journal of Controlled Release 329 2021 1077 1089 10.1016/j.jconrel.2020.10.036 Qin, C., Chu, Y., Feng, W., Fromont, C., He, S., Ali, J., Lee, J.B., Zgair, A., Berton, M., Bettonte, S., Liu, R., Yang, L., Monmaturapoj, T., Medrano-Padial, C., Ugalde, A.A.R., Vetrugno, D., Ee, S.Y., Sheriston, C., Wu, Y., Stocks, M.J., Fischer, P.M., Gershkovich, P., 2021. Targeted delivery of lopinavir to HIV reservoirs in the mesenteric lymphatic system by lipophilic ester prodrug approach. Journal of Controlled Release 329, 1077-1089. doi: 10.1016/j.jconrel.2020.10.036. Romero-Guzm\u00e1n et al., 2020 M.J. Romero-Guzm\u00e1n L. Jung K. Kyriakopoulou R.M. Boom C.V. Nikiforidis Efficient single-step rapeseed oleosome extraction using twin-screw press Journal of Food Engineering 276 2020 109890 10.1016/j.jfoodeng.2019.109890 Romero-Guzm\u00e1n, M.J., Jung, L., Kyriakopoulou, K., Boom, R.M., Nikiforidis, C.V., 2020. Efficient single-step rapeseed oleosome extraction using twin-screw press. Journal of Food Engineering 276, 109890. doi: 10.1016/j.jfoodeng.2019.109890. Salvia-Trujillo et al., 2013 L. Salvia-Trujillo C. Qian O. Mart\u00edn-Belloso D.J. McClements Influence of particle size on lipid digestion and \u03b2-carotene bioaccessibility in emulsions and nanoemulsions Food Chemistry 141 2013 1472 1480 10.1016/j.foodchem.2013.03.050 Salvia-Trujillo, L., Qian, C., Mart\u00edn-Belloso, O., McClements, D.J., 2013a. Influence of particle size on lipid digestion and \u03b2-carotene bioaccessibility in emulsions and nanoemulsions. Food Chemistry 141, 1472-1480. doi: 10.1016/j.foodchem.2013.03.050. Salvia-Trujillo et al., 2017 L. Salvia-Trujillo S. Verkempinck L. Sun A. Van Loey T. Grauwet M. Hendrickx Lipid digestion, micelle formation and carotenoid bioaccessibility kinetics: Influence of emulsion droplet size Food Chemistry 229 2017 653 662 10.1016/j.foodchem.2017.02.146 Salvia-Trujillo, L., Verkempinck, S., Sun, L., Van Loey, A., Grauwet, T., Hendrickx, M., 2017. Lipid digestion, micelle formation and carotenoid bioaccessibility kinetics: Influence of emulsion droplet size. Food Chemistry 229, 653-662. doi: 10.1016/j.foodchem.2017.02.146. Seltzer et al., 2020 E.S. Seltzer A.K. Watters D. MacKenzie L.M. Granat D. Zhang Cannabidiol (CBD) as a promising anti-cancer drug Cancers 12 2020 3203 10.3390/cancers12113203 Seltzer, E.S., Watters, A.K., MacKenzie, D., Granat, L.M., Zhang, D., 2020. Cannabidiol (CBD) as a promising anti-cancer drug. Cancers 12, 3203. doi: 10.3390/cancers12113203. The American Oil Chemists' Society, 2011 The American Oil Chemists' Society, 2011. Peroxide Value Acetic Acid-Isooctane Method, Official Methods and Recommended Practices of the AOCS. The American Oil Chemists' Society. https://www.aocs.org/attain-lab-services/methods/methods/search-results?method=111547. Tzen and Huang, 1992 J.T. Tzen A.H. Huang Surface structure and properties of plant seed oil bodies Journal of Cell Biology 117 1992 327 335 10.1083/jcb.117.2.327 Tzen, J.T., Huang, A.H., 1992. Surface structure and properties of plant seed oil bodies. Journal of Cell Biology 117, 327-335. Doi: 10.1083/jcb.117.2.327. White et al., 2009 D.A. White I.D. Fisk S. Makkhun D.A. Gray In vitro assessment of the bioaccessibility of tocopherol and fatty acids from sunflower seed oil bodies Journal of Agricultural and Food Chemistry 57 2009 5720 5726 10.1021/jf9003412 White, D.A., Fisk, I.D., Makkhun, S., Gray, D.A., 2009. In vitro assessment of the bioaccessibility of tocopherol and fatty acids from sunflower seed oil bodies. Journal of Agricultural and Food Chemistry 57, 5720-5726. doi: 10.1021/jf9003412. Yao et al., 2022 M. Yao F. Kitamura Y. Han H. Du D.J. McClements H. Xiao Adverse effects of linoleic acid: Influence of lipid oxidation on lymphatic transport of citrus flavonoid and enterocyte morphology Food Chemistry 369 2022 130968 10.1016/j.foodchem.2021.130968 Yao, M., Kitamura, F., Han, Y., Du, H., McClements, D.J., Xiao, H., 2022. Adverse effects of linoleic acid: Influence of lipid oxidation on lymphatic transport of citrus flavonoid and enterocyte morphology. Food Chemistry 369, 130968. doi: 10.1016/j.foodchem.2021.130968. Yi et al., 2014 J. Yi Y. Li F. Zhong W. Yokoyama The physicochemical stability and in vitro bioaccessibility of beta-carotene in oil-in-water sodium caseinate emulsions Food Hydrocolloids 35 2014 19 27 10.1016/j.foodhyd.2013.07.025 Yi, J., Li, Y., Zhong, F., Yokoyama, W., 2014. The physicochemical stability and invitro bioaccessibility of beta-carotene in oil-in-water sodium caseinate emulsions. Food Hydrocolloids 35, 19-27. doi: 10.1016/j.foodhyd.2013.07.025. Zgair et al., 2015 A. Zgair J.C.M. Wong A. Sabri P.M. Fischer D.A. Barrett C.S. Constantinescu P. Gershkovich Development of a simple and sensitive HPLC\u2013UV method for the simultaneous determination of cannabidiol and \u03949-tetrahydrocannabinol in rat plasma Journal of Pharmaceutical and Biomedical Analysis 114 2015 145 151 10.1016/j.jpba.2015.05.019 Zgair, A., Wong, J.C.M., Sabri, A., Fischer, P.M., Barrett, D.A., Constantinescu, C.S., Gershkovich, P., 2015. Development of a simple and sensitive HPLC\u2013UV method for the simultaneous determination of cannabidiol and \u03949-tetrahydrocannabinol in rat plasma. Journal of Pharmaceutical and Biomedical Analysis 114, 145-151. doi: 10.1016/j.jpba.2015.05.019. Zgair et al., 2016 A. Zgair J.C. Wong J.B. Lee J. Mistry O. Sivak K.M. Wasan I.M. Hennig D.A. Barrett C.S. Constantinescu P.M. Fischer P. Gershkovich Dietary fats and pharmaceutical lipid excipients increase systemic exposure to orally administered cannabis and cannabis-based medicines Am J Transl Res 8 2016 3448 3459 http://www.ncbi.nlm.nih.gov/pmc/articles/pmc5009397/ Zgair, A., Wong, J.C., Lee, J.B., Mistry, J., Sivak, O., Wasan, K.M., Hennig, I.M., Barrett, D.A., Constantinescu, C.S., Fischer, P.M., Gershkovich, P., 2016. Dietary fats and pharmaceutical lipid excipients increase systemic exposure to orally administered cannabis and cannabis-based medicines. Am J Transl Res 8, 3448-3459. http://www.ncbi.nlm.nih.gov/pmc/articles/pmc5009397/. Zgair et al., 2017 A. Zgair J.B. Lee J. Wong D.A. Taha J. Aram D. Di Virgilio J.W. McArthur Y.-K. Cheng I.M. Hennig D.A. Barrett Oral administration of cannabis with lipids leads to high levels of cannabinoids in the intestinal lymphatic system and prominent immunomodulation Scientific Reports 7 2017 1 12 10.1038/s41598-017-15026-z Zgair, A., Lee, J.B., Wong, J., Taha, D.A., Aram, J., Di Virgilio, D., McArthur, J.W., Cheng, Y.-K., Hennig, I.M., Barrett, D.A., 2017. Oral administration of cannabis with lipids leads to high levels of cannabinoids in the intestinal lymphatic system and prominent immunomodulation. Scientific reports 7, 1-12. doi: 10.1038/s41598-017-15026-z", "scopus-id": "85209649591", "pubmed-id": "39550011", "coredata": {"eid": "1-s2.0-S0378517324011815", "dc:description": "Due to high lipophilicity and extensive first-pass metabolic loss, cannabidiol (CBD) has low oral bioavailability. Co-administration of CBD and long-chain lipids facilitates the intestinal lymphatic delivery, resulting in higher systemic bioavailability, as well as high levels of the drug within the intestinal lymphatic system. However, despite previous attempts with various lipid-based formulations, the oral bioavailability of CBD is still limited. In this work, we have developed a novel formulation of CBD based on natural rapeseed oleosomes. In vivo studies in rats demonstrated that oral administration of CBD-loaded rapeseed oleosomes leads to substantially higher oral bioavailability and intestinal lymphatic targeting of CBD in comparison with rapeseed oil or artificial emulsion made of rapeseed oil and lecithin. In vitro mechanistic assessments, including in vitro lipolysis and peroxide value determination suggest that the lower oxidative state of the oil in oleosomes in comparison to crude oil or artificial emulsion is likely to be the main factor responsible for the superior performance of the CBD-loaded rapeseed oleosomes in vivo. Although further investigation will be needed, the data suggest that natural seeds-derived oleosomes can be used as a promising lipid-based drug delivery platform promoting the bioavailability and lymphatic delivery of lipophilic drugs.", "openArchiveArticle": "false", "prism:coverDate": "2025-01-05", "openaccessUserLicense": "http://creativecommons.org/licenses/by/4.0/", "prism:aggregationType": "Journal", "prism:url": "https://api.elsevier.com/content/article/pii/S0378517324011815", "dc:creator": [{"@_fa": "true", "$": "Ji, Liuhang"}, {"@_fa": "true", "$": "Feng, Wanshan"}, {"@_fa": "true", "$": "Chen, Haojie"}, {"@_fa": "true", "$": "Chu, YenJu"}, {"@_fa": "true", "$": "Wong, Abigail"}, {"@_fa": "true", "$": "Zhu, Yufei"}, {"@_fa": "true", "$": "Sinatra, Graziamarina"}, {"@_fa": "true", "$": "Bramante, Filippo"}, {"@_fa": "true", "$": "Carri\u00e8re, Fr\u00e9d\u00e9ric"}, {"@_fa": "true", "$": "Stocks, Michael J."}, {"@_fa": "true", "$": "di Bari, Vincenzo"}, {"@_fa": "true", "$": "Gray, David A."}, {"@_fa": "true", "$": "Gershkovich, Pavel"}], "link": [{"@_fa": "true", "@rel": "self", "@href": "https://api.elsevier.com/content/article/pii/S0378517324011815"}, {"@_fa": "true", "@rel": "scidir", "@href": "https://www.sciencedirect.com/science/article/pii/S0378517324011815"}], "dc:format": "application/json", "openaccessType": "Full", "pii": "S0378-5173(24)01181-5", "prism:volume": "668", "articleNumber": "124947", "prism:publisher": "The Author(s). Published by Elsevier B.V.", "dc:title": "Rapeseed oleosomes facilitate intestinal lymphatic delivery and oral bioavailability of cannabidiol", "prism:copyright": "\u00a9 2024 The Author(s). Published by Elsevier B.V.", "openaccess": "1", "prism:issn": "03785173", "dcterms:subject": [{"@_fa": "true", "$": "Cannabidiol"}, {"@_fa": "true", "$": "Intestinal lymphatic delivery"}, {"@_fa": "true", "$": "Lipid-based formulation"}, {"@_fa": "true", "$": "Rapeseed oleosomes"}, {"@_fa": "true", "$": "Oral bioavailability"}], "openaccessArticle": "true", "prism:publicationName": "International Journal of Pharmaceutics", "openaccessSponsorType": "FundingBody", "prism:pageRange": "124947", "pubType": "fla", "prism:coverDisplayDate": "5 January 2025", "prism:doi": "10.1016/j.ijpharm.2024.124947", "prism:startingPage": "124947", "dc:identifier": "doi:10.1016/j.ijpharm.2024.124947", "openaccessSponsorName": "JISC UK 2022: Hybrid journals"}, "objects": {"object": [{"@category": "standard", "@height": "167", "@width": "311", "@_fa": "true", "$": "https://api.elsevier.com/content/object/eid/1-s2.0-S0378517324011815-gr1.jpg?httpAccept=%2A%2F%2A", "@multimediatype": "JPEG image file", "@type": "IMAGE-DOWNSAMPLED", "@size": "6990", "@ref": "gr1", "@mimetype": "image/jpeg"}, {"@category": "standard", "@height": "938", "@width": "382", "@_fa": "true", "$": "https://api.elsevier.com/content/object/eid/1-s2.0-S0378517324011815-gr2.jpg?httpAccept=%2A%2F%2A", "@multimediatype": "JPEG image file", "@type": "IMAGE-DOWNSAMPLED", "@size": "54544", "@ref": "gr2", "@mimetype": "image/jpeg"}, {"@category": "standard", "@height": "200", "@width": "500", "@_fa": "true", "$": "https://api.elsevier.com/content/object/eid/1-s2.0-S0378517324011815-ga1.jpg?httpAccept=%2A%2F%2A", "@multimediatype": "JPEG image file", "@type": "IMAGE-DOWNSAMPLED", "@size": "25553", "@ref": "ga1", "@mimetype": "image/jpeg"}, {"@category": "standard", "@height": "370", "@width": "533", "@_fa": "true", "$": "https://api.elsevier.com/content/object/eid/1-s2.0-S0378517324011815-gr3.jpg?httpAccept=%2A%2F%2A", "@multimediatype": "JPEG image file", "@type": "IMAGE-DOWNSAMPLED", "@size": "36061", "@ref": "gr3", "@mimetype": "image/jpeg"}, {"@category": "standard", "@height": "484", "@width": "258", "@_fa": "true", "$": "https://api.elsevier.com/content/object/eid/1-s2.0-S0378517324011815-gr4.jpg?httpAccept=%2A%2F%2A", "@multimediatype": "JPEG image file", "@type": "IMAGE-DOWNSAMPLED", "@size": "20521", "@ref": "gr4", "@mimetype": "image/jpeg"}, {"@category": "standard", "@height": "266", "@width": "533", "@_fa": "true", "$": "https://api.elsevier.com/content/object/eid/1-s2.0-S0378517324011815-gr5.jpg?httpAccept=%2A%2F%2A", "@multimediatype": "JPEG image file", "@type": "IMAGE-DOWNSAMPLED", "@size": "25250", "@ref": "gr5", "@mimetype": "image/jpeg"}, {"@category": "standard", "@height": "886", "@width": "533", "@_fa": "true", "$": "https://api.elsevier.com/content/object/eid/1-s2.0-S0378517324011815-gr6.jpg?httpAccept=%2A%2F%2A", "@multimediatype": "JPEG image file", "@type": "IMAGE-DOWNSAMPLED", "@size": "59913", "@ref": "gr6", "@mimetype": "image/jpeg"}, {"@category": "thumbnail", "@height": "117", "@width": "219", "@_fa": "true", "$": "https://api.elsevier.com/content/object/eid/1-s2.0-S0378517324011815-gr1.sml?httpAccept=%2A%2F%2A", "@multimediatype": "GIF image file", "@type": "IMAGE-THUMBNAIL", "@size": "3759", "@ref": "gr1", "@mimetype": "image/gif"}, {"@category": "thumbnail", "@height": "162", "@width": "66", "@_fa": "true", "$": "https://api.elsevier.com/content/object/eid/1-s2.0-S0378517324011815-gr2.sml?httpAccept=%2A%2F%2A", "@multimediatype": "GIF image file", "@type": "IMAGE-THUMBNAIL", "@size": "3096", "@ref": "gr2", "@mimetype": "image/gif"}, {"@category": "thumbnail", "@height": "88", "@width": "219", "@_fa": "true", "$": "https://api.elsevier.com/content/object/eid/1-s2.0-S0378517324011815-ga1.sml?httpAccept=%2A%2F%2A", "@multimediatype": "GIF image file", "@type": "IMAGE-THUMBNAIL", "@size": "8566", "@ref": "ga1", "@mimetype": "image/gif"}, {"@category": "thumbnail", "@height": "152", "@width": "219", "@_fa": "true", "$": "https://api.elsevier.com/content/object/eid/1-s2.0-S0378517324011815-gr3.sml?httpAccept=%2A%2F%2A", "@multimediatype": "GIF image file", "@type": "IMAGE-THUMBNAIL", "@size": "5619", "@ref": "gr3", "@mimetype": "image/gif"}, {"@category": "thumbnail", "@height": "163", "@width": "87", "@_fa": "true", "$": "https://api.elsevier.com/content/object/eid/1-s2.0-S0378517324011815-gr4.sml?httpAccept=%2A%2F%2A", "@multimediatype": "GIF image file", "@type": "IMAGE-THUMBNAIL", "@size": "2603", "@ref": "gr4", "@mimetype": "image/gif"}, {"@category": "thumbnail", "@height": "109", "@width": "219", "@_fa": "true", "$": "https://api.elsevier.com/content/object/eid/1-s2.0-S0378517324011815-gr5.sml?httpAccept=%2A%2F%2A", "@multimediatype": "GIF image file", "@type": "IMAGE-THUMBNAIL", "@size": "4564", "@ref": "gr5", "@mimetype": "image/gif"}, {"@category": "thumbnail", "@height": "163", "@width": "98", "@_fa": "true", "$": "https://api.elsevier.com/content/object/eid/1-s2.0-S0378517324011815-gr6.sml?httpAccept=%2A%2F%2A", "@multimediatype": "GIF image file", "@type": "IMAGE-THUMBNAIL", "@size": "3858", "@ref": "gr6", "@mimetype": "image/gif"}, {"@category": "high", "@height": "739", "@width": "1378", "@_fa": "true", "$": "https://api.elsevier.com/content/object/eid/1-s2.0-S0378517324011815-gr1_lrg.jpg?httpAccept=%2A%2F%2A", "@multimediatype": "JPEG image file", "@type": "IMAGE-HIGH-RES", "@size": "32748", "@ref": "gr1", "@mimetype": "image/jpeg"}, {"@category": "high", "@height": "4159", "@width": "1693", "@_fa": "true", "$": "https://api.elsevier.com/content/object/eid/1-s2.0-S0378517324011815-gr2_lrg.jpg?httpAccept=%2A%2F%2A", "@multimediatype": "JPEG image file", "@type": "IMAGE-HIGH-RES", "@size": "429283", "@ref": "gr2", "@mimetype": "image/jpeg"}, {"@category": "high", "@height": "885", "@width": "2213", "@_fa": "true", "$": "https://api.elsevier.com/content/object/eid/1-s2.0-S0378517324011815-ga1_lrg.jpg?httpAccept=%2A%2F%2A", "@multimediatype": "JPEG image file", "@type": "IMAGE-HIGH-RES", "@size": "196419", "@ref": "ga1", "@mimetype": "image/jpeg"}, {"@category": "high", "@height": "1639", "@width": "2362", "@_fa": "true", "$": "https://api.elsevier.com/content/object/eid/1-s2.0-S0378517324011815-gr3_lrg.jpg?httpAccept=%2A%2F%2A", "@multimediatype": "JPEG image file", "@type": "IMAGE-HIGH-RES", "@size": "270201", "@ref": "gr3", "@mimetype": "image/jpeg"}, {"@category": "high", "@height": "2144", "@width": "1142", "@_fa": "true", "$": "https://api.elsevier.com/content/object/eid/1-s2.0-S0378517324011815-gr4_lrg.jpg?httpAccept=%2A%2F%2A", "@multimediatype": "JPEG image file", "@type": "IMAGE-HIGH-RES", "@size": "159383", "@ref": "gr4", "@mimetype": "image/jpeg"}, {"@category": "high", "@height": "1179", "@width": "2362", "@_fa": "true", "$": "https://api.elsevier.com/content/object/eid/1-s2.0-S0378517324011815-gr5_lrg.jpg?httpAccept=%2A%2F%2A", "@multimediatype": "JPEG image file", "@type": "IMAGE-HIGH-RES", "@size": "187300", "@ref": "gr5", "@mimetype": "image/jpeg"}, {"@category": "high", "@height": "3926", "@width": "2362", "@_fa": "true", "$": "https://api.elsevier.com/content/object/eid/1-s2.0-S0378517324011815-gr6_lrg.jpg?httpAccept=%2A%2F%2A", "@multimediatype": "JPEG image file", "@type": "IMAGE-HIGH-RES", "@size": "471658", "@ref": "gr6", "@mimetype": "image/jpeg"}, {"@category": "standard", "@_fa": "true", "$": "https://api.elsevier.com/content/object/eid/1-s2.0-S0378517324011815-mmc1.docx?httpAccept=%2A%2F%2A", "@multimediatype": "Microsoft Word file", "@type": "APPLICATION", "@size": "480137", "@ref": "mmc1", "@mimetype": "application/word"}, {"@category": "thumbnail", "@_fa": "true", "$": "https://api.elsevier.com/content/object/eid/1-s2.0-S0378517324011815-si1.svg?httpAccept=%2A%2F%2A", "@multimediatype": "Scalable Vector Graphics file", "@type": "ALTIMG", "@size": "26654", "@ref": "si1", "@mimetype": "image/svg+xml"}]}, "link": {"@rel": "abstract", "@href": "https://api.elsevier.com/content/abstract/scopus_id/85209649591"}}